Sr. No.,id,name,host_is_superhost,neighbourhood,latitude,longitude,price in USD,guests_included,Region
1913,7857502,Gorgeous Victorian in the Heart of the City,f,Duboce Triangle,37.76525,-122.43316,350.00 ,4,Western Addition
1914,7859448,"City Views, Potrero Hill 2  Bdrm Newly Remodeled",f,Potrero Hill,37.76224,-122.39674,180.00 ,1,Southern
1915,7867825,Private rv parked on Potrero Hill.,f,Potrero Hill,37.76519,-122.40375,50.00 ,1,Southern
1916,7870535,Luxury Flat in Marina District,f,Marina,37.80225,-122.44212,245.00 ,1,North of Downtown
1917,7873804,Private Room in Mission District,f,Mission District,37.76721,-122.41712,400.00 ,4,Southern
1918,7884875,"2BD/2BA Market St Retreat, Castro w/ SF City Views",t,Twin Peaks,37.75777,-122.44346,350.00 ,4,Western Addition
1919,7886634,Blissful Studio in Heart of Castro,f,The Castro,37.7593,-122.43895,125.00 ,1,Western Addition
1920,7896925,Charming Condo with Garden Patio,f,Mission District,37.75667,-122.41053,400.00 ,1,Southern
1921,7897391,Downtown SF Timeshare/Hotel Studio,t,Union Square,37.78738,-122.40983,180.00 ,1,Downtown
1922,7899085,private Potrero Hill apartment,t,Potrero Hill,37.76065,-122.40146,140.00 ,2,Southern
1923,7901865,Spacious Cole Valley family home,f,Cole Valley,37.76488,-122.44805,475.00 ,1,Western Addition
1924,7902505,Your Private Space in Potrero Hill,t,Potrero Hill,37.75531,-122.39975,150.00 ,1,Southern
1925,7902889,Couch in sunny Soma Loft,f,SoMa,37.78594,-122.39409,90.00 ,1,Southern
1926,7903768,May-July 1BD in Dwntown nr shuttle,f,SoMa,37.77698,-122.41384,100.00 ,1,Southern
1927,7914711,Champs Elysees,f,Mission District,37.76178,-122.42216,120.00 ,2,Southern
1928,7915270,Dolce Vita,f,Mission District,37.76308,-122.42155,100.00 ,2,Southern
1929,7921739,"Luxury 1 Bed Apt, Marina/GGB Views",t,Marina,37.80528,-122.44026,329.00 ,2,North of Downtown
1930,7922690,Spacious Room in Luxury Home,t,Visitacion Valley,37.71143,-122.40057,100.00 ,2,Southern
1931,7930461,Modern suite with private entrance & bathroom,t,Inner Sunset,37.74117,-122.4635,109.00 ,1,Western Addition
1932,7931074,Sunny Private One Bedroom Unit,t,Mission District,37.75076,-122.41797,185.00 ,2,Southern
1933,7933407,2 BR Upper Level Flat in the Mission!,t,Potrero Hill,37.76462,-122.40675,225.00 ,1,Southern
1934,7933558,UPSCALE MODERN PRIVATE ROOM IN PENTHOUSE MID,t,Western Addition/NOPA,37.78443,-122.44355,49.00 ,1,Western Addition
1935,7933807,Like New 2 BR/2 BA/Free parking/Netflix,t,Outer Sunset,37.74758,-122.4907,200.00 ,4,Southern
1936,7939511,Spacious guestroom w/ en suite,t,Bernal Heights,37.74576,-122.41543,95.00 ,1,Southern
1937,7949624,SAN FRANCISCO PARADISE W/EASY  FREE PARKING,t,Potrero Hill,37.75526,-122.39827,139.00 ,2,Southern
1938,7949668,"WELCOME TO YOUR HOME AWAY FROM HOME,FREE PARKING",t,Potrero Hill,37.75512,-122.40041,139.00 ,2,Southern
1939,7950946,Private/Secure Home for Rent,t,Outer Sunset,37.76351,-122.49791,350.00 ,1,Southern
1940,7958214,Downtown Spacious Hotel/TS Studio,t,Union Square,37.78664,-122.40943,180.00 ,1,Downtown
1941,7958278,Downtown SF Large Hotel/TS Studio,t,Downtown,37.78836,-122.41063,180.00 ,1,Downtown
1942,7958316,Downtown Timeshare/Hotel Studio USq,t,Downtown,37.7877,-122.40991,180.00 ,1,Downtown
1943,7958349,Downtown Top U. Sq. Hotel/TS Studio,t,Union Square,37.78846,-122.40959,180.00 ,1,Downtown
1944,7963103,SF Hotel Studio: Union Square (7),t,Downtown,37.78837,-122.41091,269.00 ,1,Downtown
1945,7968598,Bright and Sunny Top Floor Flat,t,Duboce Triangle,37.76684,-122.43435,220.00 ,1,Western Addition
1946,7968749,North Beach/Telegraph Hill Gem! - ROOF DECK/VIEWS!,t,Telegraph Hill,37.80332,-122.40782,600.00 ,1,Downtown
1947,7972067,Beautiful Backyard w-BBQ ⭐️ W/D ⭐️ Parking ⭐️ HBO,f,Richmond District,37.78056,-122.44744,155.00 ,2,Outside Lands
1948,7973781,Classic San Francisco Victorian,f,Bernal Heights,37.7459,-122.42015,255.00 ,2,Southern
1949,7975011,Penthouse Master w/ private bath,t,Western Addition/NOPA,37.78457,-122.44501,69.00 ,2,Western Addition
1950,7982082,"Gorgeous SF home, spectacular downtown views",t,Diamond Heights,37.74697,-122.43817,450.00 ,4,Southern
1951,7985260,Rue de la Paix,f,Mission District,37.76171,-122.42202,120.00 ,2,Southern
1952,7989636,Top floor - Private bath & free parking,t,Nob Hill,37.79617,-122.41236,140.00 ,2,Downtown
1953,7998215,Relax in a Historic House Located in the Heart of the Mission District,t,Mission District,37.75054,-122.41656,173.00 ,2,Southern
1954,8005452,Noe Valley 2 BR top floor Victorian,t,Noe Valley,37.75114,-122.43233,295.00 ,2,Southern
1955,8030646,Quiet Private Suite with Backyard in Modern Mission Home,t,Mission District,37.75032,-122.41668,99.00 ,1,Southern
1956,8033268,Downtown Union Sq TS/Hotel Studio,t,Downtown,37.78846,-122.41054,180.00 ,1,Downtown
1957,8033975,Downtown SF Hotel/TS Union Square,t,Union Square,37.78749,-122.40949,180.00 ,1,Downtown
1958,8041262,Castro 4Bed/2Bath with City views!,f,The Castro,37.75927,-122.43158,495.00 ,1,Western Addition
1959,8048653,Master Room in Luxury Apartment,t,Visitacion Valley,37.71299,-122.40017,120.00 ,2,Southern
1960,8049455,STUDIO POTRERO,t,Potrero Hill,37.75909,-122.40056,175.00 ,1,Southern
1961,8051735,Beautiful 3BR Ocean Beach Home,f,Outer Sunset,37.75284,-122.50436,162.00 ,4,Southern
1962,8053481,"Spacious, sunny, 3 bdrm/3 bath home nr Valencia St",t,Mission District,37.75417,-122.42153,275.00 ,3,Southern
1963,8053887,Spacious Home Upper Market- Easy Parking,t,Twin Peaks,37.75967,-122.44688,185.00 ,3,Western Addition
1964,8055632,Guest Room in Renovated Apartment,t,Visitacion Valley,37.71297,-122.40053,120.00 ,3,Southern
1965,8061617,Lux 1BR Apt in San Francisco w/pool,f,Mission Bay,37.77051,-122.3926,299.00 ,1,Downtown
1966,8066789,1Br-4Br/2Ba Apt in Heart of Mission,f,Mission District,37.76264,-122.42082,"3,200.00 ",1,Southern
1967,8068539,Modern 3Bd Edwardian Renovated Flat,f,Mission District,37.7597,-122.42317,269.00 ,1,Southern
1968,8082364,Upgraded 2BR nestled in Back Garden,f,Telegraph Hill,37.79878,-122.40585,170.00 ,3,Downtown
1969,8084285,Downtown SF USq Hotel/TS Studio,t,Downtown,37.78846,-122.41062,190.00 ,1,Downtown
1970,8084290,Downtown SF Un. Sq. Hotel/TS Studio,t,Downtown,37.78722,-122.41068,190.00 ,1,Downtown
1971,8085920,Gorgeous Views: Room and an office,t,Noe Valley,37.75345,-122.44196,129.00 ,1,Southern
1972,8086877,Lux 1BR Apt in San Francisco w/WiFi,f,Financial District,37.79801,-122.40037,272.00 ,1,Downtown
1973,8089051,Downtown Hotel/TS Studio Union Sq,t,Downtown,37.78846,-122.41117,250.00 ,1,Downtown
1974,8090484,Beautiful apartment in Nob Hill,f,Nob Hill,37.79248,-122.41844,100.00 ,2,Downtown
1975,8101297,Marina District One Bedroom,t,Marina,37.80194,-122.44017,149.00 ,1,North of Downtown
1976,8101619,"Private, Garage, Deck, sleeps 6",f,Noe Valley,37.74552,-122.43499,250.00 ,2,Southern
1977,8102262,Queen Bedroom w/ Best of Everything,t,Bayview,37.7302,-122.39827,60.00 ,1,Southern
1978,8105804,Contemporary Comfort -heart of FiDi,f,SoMa,37.78724,-122.39937,301.00 ,1,Southern
1979,8105974,"Sunny&Quiet 2BDR loft, Top location",t,Mission District,37.75842,-122.41196,358.00 ,2,Southern
1980,8117174,"House with Golden Gate Bridge view, large backyard",f,Bernal Heights,37.74663,-122.40726,299.00 ,1,Southern
1981,8117667,Perfect Location! Private bathroom too!,t,Inner Sunset,37.76421,-122.46433,139.00 ,1,Western Addition
1982,8119395,Grand 4-Level Painted Lady Victorian with Parking,t,Western Addition/NOPA,37.78518,-122.44283,"2,000.00 ",1,Western Addition
1983,8151985,ｻﾝﾌﾗﾝｼｽｺで一番天気の良く､ｼﾞｬｲｱﾝﾂ球場の見えるｱﾊﾟｰﾄ｡,f,Potrero Hill,37.75977,-122.40096,280.00 ,3,Southern
1984,8152867,Private room/bathroom w/parking,t,Richmond District,37.77745,-122.47989,99.00 ,1,Outside Lands
1985,8155106,Ashbury Heights Elegant Flat,t,Haight-Ashbury,37.76731,-122.4458,175.00 ,1,Western Addition
1986,8155586,House with Beautiful City View (Big House),t,Portola,37.72213,-122.40632,410.00 ,7,Southern
1987,8159544,Modern/Convenient SOMA Room,f,SoMa,37.77514,-122.40897,200.00 ,1,Southern
1988,8164773,Pristine Studio in Haight Ashbury- 30 days or More,t,Haight-Ashbury,37.77016,-122.44807,210.00 ,2,Western Addition
1989,8167459,PRIVATE ENTRY - Garden Studio - Near Ocean Beach,t,Richmond District,37.77812,-122.50262,133.00 ,1,Outside Lands
1990,8172628,Quiet & Cozy Victorian-Alamo Square,t,Western Addition/NOPA,37.77856,-122.43633,140.00 ,1,Western Addition
1991,8184928,Beautiful Potrero Hill Apt. Parking,f,Potrero Hill,37.76054,-122.40396,110.00 ,2,Southern
1992,8187584,"Private Entrance, Bath & Kitchenette",t,Noe Valley,37.74844,-122.4282,145.00 ,1,Southern
1993,8192881,Delmar Street guest suite w/ panoramic city views,f,Haight-Ashbury,37.76922,-122.44698,150.00 ,1,Western Addition
1994,8195090,Charming studio w kitchen and bath,t,Noe Valley,37.75377,-122.44197,135.00 ,1,Southern
1995,8195144,Private studio with bath + free street parking,f,Twin Peaks,37.75135,-122.45383,134.00 ,2,Western Addition
1996,8202578,SF Hotel Studio: Union Square (3),t,Downtown,37.78835,-122.4112,249.00 ,1,Downtown
1997,8207665,SF home-walk to Golden Gate Park. Shared entryway.,t,Richmond District,37.77785,-122.48011,204.00 ,4,Outside Lands
1998,8208052,Five Star Luxury Condo Civic Center/Hayes Valley,f,Western Addition/NOPA,37.78397,-122.42254,129.00 ,2,Western Addition
1999,8209055,Sunset Views from a Charming & Classic San Francisco Home,t,Western Addition/NOPA,37.78835,-122.42833,150.00 ,1,Western Addition
2000,8209591,BEAUTIFUL VICTORIAN SUITE VIEWS MISSION DISTRICT,f,Potrero Hill,37.75429,-122.4012,39.00 ,1,Southern
2001,8221207,Clean sweet space in Bernal Heights,f,Bernal Heights,37.74067,-122.41489,140.00 ,1,Southern
2002,8241198,Large House w/ Balconies & Stunning Views,f,North Beach,37.80031,-122.41268,350.00 ,4,Downtown
2003,8255072,"Lg bedroom with bath, very private.",f,Bayview,37.7352,-122.38566,100.00 ,1,Southern
2004,8270952,Bamboo Bungalow -  Cozy &  Most Convenient,f,The Castro,37.76479,-122.43145,130.00 ,2,Western Addition
2005,8272458,Perfect flat for travelers in peaceful Noe Valley,f,Noe Valley,37.75411,-122.43832,259.00 ,1,Southern
2006,8274904,"Elegant, Private Queen Atrium Suite",t,Haight-Ashbury,37.76757,-122.43639,120.00 ,1,Western Addition
2007,8275596,"Sweet Sunnyside Suite, Private Entrance & Bathroom",t,Sunnyside,37.73035,-122.4452,104.00 ,2,Western Addition
2008,8276309,Restored Lower Haight Edwardian,t,Hayes Valley,37.77191,-122.43226,95.00 ,1,Western Addition
2009,8277718,Cozy Private Room&Bathroom in Bayview Heights! :),f,Bayview,37.71755,-122.39659,90.00 ,2,Southern
2010,8287266,Victorian in the heart of Castro,t,The Castro,37.76414,-122.43189,150.00 ,1,Western Addition
2011,8290464,Garden Studio with Private Entrance,t,Potrero Hill,37.76391,-122.39553,185.00 ,1,Southern
2012,8308630,2 Beds in Cozy Mission Room,f,Mission District,37.75829,-122.41963,89.00 ,2,Southern
2013,8322874,Redwood hideaway in the heart of the San Francisco,t,SoMa,37.77025,-122.41319,299.00 ,4,Southern
2014,8328410,Low Nob Hill Sutter St Studio 2+1px,f,Downtown,37.78894,-122.41722,149.00 ,1,Downtown
2015,8336042,Sunny Mission studio with private access,t,Bernal Heights,37.74728,-122.40766,165.00 ,2,Southern
2016,8336228,Modern Mission 2 Bedroom with private access,t,Bernal Heights,37.74727,-122.40863,250.00 ,4,Southern
2017,8338986,Beautiful 1 Bedroom in Fin District,f,SoMa,37.78935,-122.39862,255.00 ,1,Southern
2018,8340498,"Financial district, Walk Everywhere",f,Financial District,37.79602,-122.39837,176.00 ,1,Downtown
2019,8342838,Spacious room in luxury 2BD/2BA,f,SoMa,37.78424,-122.39925,100.00 ,1,Southern
2020,8351923,Cozy Garden Unit with All Amenities,t,Forest Hill,37.74288,-122.46147,99.00 ,1,Outside Lands
2021,8352275,Cozy Room in Sight of the Sea,t,Richmond District,37.77898,-122.50675,129.00 ,1,Outside Lands
2022,8355076,Sunlit Room in Mission with Patio,f,Mission District,37.75789,-122.41487,130.00 ,1,Southern
2023,8356380,"Quiet Private Room - Studio Feel, Parking",t,Crocker Amazon,37.7117,-122.43451,98.00 ,1,Southern
2024,8382187,"In law studio, kitchen, garage parking, near beach",f,Richmond District,37.77974,-122.49897,100.00 ,2,Outside Lands
2025,8411606,comfy oceanside nest,t,Richmond District,37.78668,-122.49316,135.00 ,1,Outside Lands
2026,8418067,Victorian Penthouse for a month,f,Western Addition/NOPA,37.78409,-122.4438,293.00 ,4,Western Addition
2027,8422161,Location!! Executive Penthouse,f,SoMa,37.78758,-122.39868,501.00 ,1,Southern
2028,8438267,Beautiful View Apartment,t,Potrero Hill,37.76118,-122.3967,195.00 ,2,Southern
2029,8456859,Perfect Haven by Golden Gate Park and Ocean Beach.,f,Richmond District,37.77392,-122.50925,150.00 ,1,Outside Lands
2030,8459807,"3 bedrooms, 5 beds Mission Valencia",f,Mission District,37.7583,-122.41948,220.00 ,5,Southern
2031,8461190,"Spacious, modern mission flat",t,Mission District,37.75126,-122.40794,155.00 ,1,Southern
2032,8464365,Spacious room in a Noe Valley condo with a view,t,Noe Valley,37.75148,-122.44182,95.00 ,1,Southern
2033,8472083,Newly renovated Marina Private Suite with Bathroom,t,Marina,37.80259,-122.42695,170.00 ,2,North of Downtown
2034,8472666,Sunny Urban Sanctuary,f,SoMa,37.77219,-122.41672,250.00 ,1,Southern
2035,8472927,Spacious charming 1 bedroom suite!,t,Balboa Terrace,37.728,-122.46162,144.00 ,2,Western Addition
2036,8474183,★Walk Score 90 & Parking★Patio★Laundry★ Ground,t,Mission Terrace,37.72207,-122.43773,177.00 ,1,Outside Lands
2037,8474452,Private Entry & Bath Suite by BART,t,Bernal Heights,37.73391,-122.42901,109.00 ,1,Southern
2038,8480722,Noe Valley Flat,f,Noe Valley,37.75317,-122.43643,175.00 ,1,Southern
2039,8482762,Unique room in a Noe Valley house.,t,Noe Valley,37.74952,-122.43639,95.00 ,1,Southern
2040,8484211,Unique Private Room in Noe Valley,t,Noe Valley,37.74739,-122.43746,110.00 ,1,Southern
2041,8487735,Modern and functional space,t,Excelsior,37.72944,-122.42899,115.00 ,1,Southern
2042,8489712,The V - An elegant modern studio,t,Western Addition/NOPA,37.78268,-122.4222,110.00 ,1,Western Addition
2043,8499631,Bright Modern Mission Studio,t,Mission District,37.74855,-122.40941,260.00 ,1,Southern
2044,8500048,"Beautiful, Modern Oasis in Fantastic location!",t,Inner Sunset,37.76104,-122.47504,159.00 ,1,Western Addition
2045,8501670,North Beach 1 Bedrm Parc Telegraph,f,Telegraph Hill,37.80297,-122.405,246.00 ,1,Downtown
2046,8520295,Peaceful studio/ Garden,t,Outer Sunset,37.7602,-122.48114,129.00 ,2,Southern
2047,8524982,Private in-law suite + Roofdeck & Views! N. Beach,t,North Beach,37.80302,-122.41025,175.00 ,2,Downtown
2048,8542873,1BD Beach Retreat w/ Garage Parking!,f,Outer Sunset,37.75573,-122.50436,138.00 ,2,Southern
2049,8554141,The Bartlett QUEEN,f,Downtown,37.7868,-122.40775,110.00 ,1,Downtown
2050,8556635,Large 2 story home in SF,f,Bernal Heights,37.74053,-122.40893,186.00 ,2,Southern
2051,8564563,Comfy SF Mission District Victorian - 2 Bdrm,f,Mission District,37.76867,-122.41786,220.00 ,4,Southern
2052,8565105,The Bartlett QUEEN,f,Downtown,37.78735,-122.40782,110.00 ,1,Downtown
2053,8565153,The Bartlett QUEEN,f,Downtown,37.78601,-122.40826,110.00 ,1,Downtown
2054,8565299,SINGLE FAMILY 2BR/2BA MISSION HOME,f,Mission District,37.74916,-122.41986,950.00 ,2,Southern
2055,8568826,Home with view and free parking,t,Bernal Heights,37.74262,-122.40875,95.00 ,1,Southern
2056,8576907,Stylish Home with Fireplace and Deck near Golden Gate Park,f,Richmond District,37.77858,-122.4492,599.00 ,4,Outside Lands
2057,8578964,Gorgeous Loft with Amazing Light in SOMA,f,SoMa,37.77941,-122.39551,550.00 ,1,Southern
2058,8584000,"Chic, Bright & Airy in Hayes Valley",t,Hayes Valley,37.77397,-122.42783,250.00 ,4,Western Addition
2059,8591098,San Francisco - Beautiful 1899 Home,f,Haight-Ashbury,37.7718,-122.44404,"1,000.00 ",1,Western Addition
2060,8592609,Sunny Noe Cottage Corporate Housing,f,Noe Valley,37.75477,-122.42709,169.00 ,2,Southern
2061,8595304,Private Bdrm/bath/Queen Bed For 1 Guest Only,t,Noe Valley,37.74672,-122.43613,225.00 ,1,Southern
2062,8597021,Private room w/King Bed steps from Glen Park BART,t,Mission Terrace,37.7304,-122.43331,103.00 ,1,Outside Lands
2063,8612967,Gorgeous & Modern Nob Hill Flat,f,Nob Hill,37.79552,-122.41065,499.00 ,8,Downtown
2064,8633201,Large Castro 3 bedroom with Hot Tub :),t,The Castro,37.75942,-122.44133,250.00 ,4,Western Addition
2065,8646903,*NEW* MARINA LUXURY BEACH COTTAGE,f,Marina,37.80317,-122.44204,220.00 ,2,North of Downtown
2066,8653346,Remodeled Classic Condominium Comfort near Duboce Park,f,Lower Haight,37.77084,-122.4303,200.00 ,1,Western Addition
2067,8655125,4 BR/4BA Bernal Heights Victorian,t,Bernal Heights,37.73638,-122.41937,360.00 ,1,Southern
2068,8673754,Amazing Golden Gate Views w/Parking,t,Russian Hill,37.80305,-122.42155,450.00 ,1,North of Downtown
2069,8684508,The Bartlett QUEEN,f,Downtown,37.78768,-122.4099,110.00 ,1,Downtown
2070,8685652,The Bartlett QUEEN,f,Union Square,37.78684,-122.4094,110.00 ,1,Downtown
2071,8685716,The Bartlett QUEEN,f,Downtown,37.78688,-122.409,110.00 ,1,Downtown
2072,8685766,The Bartlett QUEEN,f,Union Square,37.7872,-122.40811,89.00 ,1,Downtown
2073,8685817,The Bartlett QUEEN,f,Union Square,37.78543,-122.40831,110.00 ,1,Downtown
2074,8685898,The Bartlett QUEEN,f,Union Square,37.78546,-122.4085,40.00 ,1,Downtown
2075,8701367,Victorian Apartment in the Heart of the Mission,f,Mission District,37.75042,-122.41512,187.00 ,1,Southern
2076,8713608,Luxury Furnished Studio - shared,f,SoMa,37.78406,-122.40517,200.00 ,1,Southern
2077,8717641,Beautiful Private Garden Apt. Nr. Golden Gate Park,t,Richmond District,37.77859,-122.46735,185.00 ,1,Outside Lands
2078,8733261,"San Francisco Home, Great View, Private Room #2",f,Bayview,37.73238,-122.38702,69.00 ,1,Southern
2079,8734202,Cute 1 bedroom in the Mission,f,Mission District,37.76805,-122.42152,150.00 ,1,Southern
2080,8735636,Beautiful Russian Hill Flat,f,Russian Hill,37.80073,-122.41798,550.00 ,1,North of Downtown
2081,8758259,Sunny Bedroom-Large Victorian Flat,f,Nob Hill,37.79148,-122.41479,155.00 ,1,Downtown
2082,8760949,1920s Modern - Sunny 2 Bedroom on Valencia Street,f,SoMa,37.77231,-122.4213,320.00 ,2,Southern
2083,8762967,Mission Hideaway with Outdoor patio,t,Mission District,37.75125,-122.40826,160.00 ,1,Southern
2084,8763366,Bunk bed in Treat Street Hostel,t,Mission District,37.7583,-122.4128,55.00 ,1,Southern
2085,8763407,Bunk bed in Treat Street Hostel,t,Mission District,37.7581,-122.41388,55.00 ,1,Southern
2086,8763529,Bunk bed in Treat Street Hostel,t,Mission District,37.75789,-122.41317,55.00 ,1,Southern
2087,8763620,Bunk bed in Treat Street Hostel,t,Mission District,37.75818,-122.41288,33.00 ,1,Southern
2088,8775500,Mini Guest House Rental - Bedroom Only,f,Pacific Heights,37.78916,-122.44018,150.00 ,1,North of Downtown
2089,8793569,Noe Valley Room w/ private entrance,f,Mission District,37.75612,-122.42588,120.00 ,1,Southern
2090,8794180,Beautiful Pacific Heights 1 bedroom,f,Pacific Heights,37.79522,-122.42651,188.00 ,1,North of Downtown
2091,8799100,Victorian Family Home at Mission Dolores Park,t,Mission District,37.76176,-122.42492,435.00 ,1,Southern
2092,8800012,SF Union Square Hotel Studio (6),t,Union Square,37.78799,-122.40925,269.00 ,1,Downtown
2093,8817059,Pacific Overlook in San Francisco,t,Inner Sunset,37.75231,-122.46994,400.00 ,6,Western Addition
2094,8859249,Gorgeous mid century gem.,t,Outer Sunset,37.76419,-122.49092,150.00 ,2,Southern
2095,8864274,Classic Elegance Pacific Heights,f,Pacific Heights,37.79049,-122.44472,"1,200.00 ",8,North of Downtown
2096,8869066,Noe Valley Victorian guest suite,t,Noe Valley,37.75319,-122.43805,190.00 ,2,Southern
2097,8869806,Large Updated San Francisco Home,t,Lower Haight,37.77221,-122.43236,155.00 ,2,Western Addition
2098,8881503,Charming & Chic Dolores Park Condo,f,Mission District,37.75861,-122.42491,166.00 ,3,Southern
2099,8886022,Sunny Corporate Rental in Trendy Valencia Corridor,f,Mission District,37.75527,-122.42284,119.00 ,2,Southern
2100,8889145,"Clean, quiet, & centrally located",f,Western Addition/NOPA,37.77872,-122.44187,124.00 ,1,Western Addition
2101,8901394,Lavish 1 Bedroom Apt in the heart of San Francisco,f,South Beach,37.79143,-122.39136,249.00 ,1,Southern
2102,8902399,Modern 2 Bedroom San Francisco Apartment,f,South Beach,37.7913,-122.39178,309.00 ,1,Southern
2103,8903225,Luxury Furnished 2Bedroom CA Apt  by the Bay,f,South Beach,37.79268,-122.39159,279.00 ,1,Southern
2104,8904047,Hot Spot with Cozy Pied-a-terre!,t,Mission District,37.76281,-122.42825,155.00 ,1,Southern
2105,8907289,2-Room Suite in Vibrant Mission,t,Mission District,37.75268,-122.40753,144.00 ,2,Southern
2106,8908249,Studio in the center of SF F4,f,Western Addition/NOPA,37.77418,-122.43133,90.00 ,2,Western Addition
2107,8914789,Deluxe 1-Bedroom China Basin Apartment!,f,Mission Bay,37.77083,-122.39427,229.00 ,1,Downtown
2108,8915580,Luxury 1 Bedroom San Francisco Apt!!,f,Mission Bay,37.77098,-122.39428,189.00 ,1,Downtown
2109,8915995,Upscale 2 Bedroom China Basin Apt!,f,Mission Bay,37.77237,-122.39253,299.00 ,1,Downtown
2110,8916368,Beautifully Furnished 1 Bedroom San Francisco Apt!,f,Nob Hill,37.79513,-122.41994,229.00 ,1,Downtown
2111,8925997,Large Inner Richmond Flat 2 Bed 2ba,f,Richmond District,37.78528,-122.46538,310.00 ,1,Outside Lands
2112,8926024,Large Inner Richmond Flat 2 Bed 1ba,f,Richmond District,37.78404,-122.46688,270.00 ,1,Outside Lands
2113,8926150,Remodeled 1 Bedroom-Great Location,f,Nob Hill,37.79584,-122.41048,145.00 ,1,Downtown
2114,8941317,Above the Clouds of San Francisco,t,Haight-Ashbury,37.768,-122.43721,429.00 ,3,Western Addition
2115,8943055,Private Master Suite above the Clouds,t,Haight-Ashbury,37.76762,-122.43748,189.00 ,1,Western Addition
2116,8955959,Private Room in Condo with 2 Cats & Quiet Lab,f,Lower Haight,37.77287,-122.43402,165.00 ,1,Western Addition
2117,8974563,Nice room in a 1890 Noe Valley Victorian,t,Noe Valley,37.74799,-122.42571,90.00 ,1,Southern
2118,8987674,Peaceful Bedroom with Deck near Fillmore Street,t,Pacific Heights,37.78918,-122.4419,186.00 ,1,North of Downtown
2119,8992582,bright cozy room amazing view,f,Twin Peaks,37.75186,-122.4441,55.00 ,2,Western Addition
2120,8993289,Central Union Sq Nob Hill Studio,t,Downtown,37.78727,-122.41062,180.00 ,1,Downtown
2121,8993301,Central Union Sq. Hotel/TS Studio,t,Downtown,37.78819,-122.4095,180.00 ,1,Downtown
2122,8993307,Central Hotel/TS Studio Un. Sq.,t,Union Square,37.78897,-122.41002,180.00 ,1,Downtown
2123,9010937,Zen sanctuary in the Mission,t,Mission District,37.75245,-122.40706,251.00 ,4,Southern
2124,9021715,Charming 1884 House Lr Pacific Hts,f,Western Addition/NOPA,37.7857,-122.44465,299.00 ,3,Western Addition
2125,9051149,Great Castro location,t,Duboce Triangle,37.7692,-122.43531,99.00 ,1,Western Addition
2126,9051457,"Modern, family friendly home w/ ping pong table",f,Glen Park,37.73491,-122.42977,445.00 ,8,Southern
2127,9059999,Chic Castro Condo,f,The Castro,37.76018,-122.43225,170.00 ,1,Western Addition
2128,9061912,NEAR IT ALL- IDEAL Location!Steps to Financial ds,f,Union Square,37.78976,-122.40809,202.00 ,2,Downtown
2129,9063798,Lower Haight Condo Parking+HotTub-nr NOPA Castro,t,Hayes Valley,37.77291,-122.43641,115.00 ,1,Western Addition
2130,9067632,Sunny twin bedroom overlooks garden,t,Noe Valley,37.7439,-122.42547,76.00 ,1,Southern
2131,9075976,3 BR Home by the Beach with Sunset Ocean Views,f,Outer Sunset,37.7369,-122.50093,164.00 ,1,Southern
2132,9108108,3BR Apartment For Family Gettaway,f,Mission District,37.75191,-122.40497,350.00 ,1,Southern
2133,9110032,Modern Room by Golden Gate Park (Green Butterfly),t,Richmond District,37.77301,-122.50109,100.00 ,2,Outside Lands
2134,9110654,"Sunny, family-friendly and charming",f,Forest Hill,37.74536,-122.45548,495.00 ,1,Outside Lands
2135,9110718,"*BAYFRONT*Spacious,Marina Blvd Home 30 days +",t,Marina,37.80661,-122.43557,350.00 ,1,North of Downtown
2136,9118962,Modern Room by Golden Gate Park (Orange Butterfly),t,Richmond District,37.7734,-122.50268,100.00 ,2,Outside Lands
2137,9119210,Modern Room by Golden Gate Park (Blue Butterfly),t,Richmond District,37.77241,-122.50169,100.00 ,2,Outside Lands
2138,9119249,Inn at the Opera Hotel Room,t,Western Addition/NOPA,37.77981,-122.4219,140.00 ,1,Western Addition
2139,9127072,"Large, Sunny and Private Room in Noe Valley Flat",t,Noe Valley,37.7518,-122.42562,55.00 ,1,Southern
2140,9130888,Mission Sanctuary,f,Mission District,37.75728,-122.40849,95.00 ,4,Southern
2141,9150171,Room in Historic SF,f,Haight-Ashbury,37.7693,-122.4514,99.00 ,1,Western Addition
2142,9150423,"By Public Train/Bus Stops, UCSF, Golden Gate Park",t,Cole Valley,37.76467,-122.45561,109.00 ,1,Western Addition
2143,9150562,Private Room in Ingleside nearby SFSU,f,Oceanview,37.72062,-122.46706,50.00 ,1,Outside Lands
2144,9150693,Monthly 3 Broadway .Financial .Chinatown,f,Telegraph Hill,37.799,-122.40403,82.00 ,2,Downtown
2145,9156193,Central USq Timeshare/Hotel Studio,t,Downtown,37.78697,-122.40961,180.00 ,1,Downtown
2146,9157940,Central SF Timeshare/Hotel (Un Sq.),t,Downtown,37.78848,-122.4106,180.00 ,1,Downtown
2147,9172460,Deluxe Working Artist''s Loft,t,Western Addition/NOPA,37.78329,-122.44518,355.00 ,2,Western Addition
2148,9180885,Pacific Heights Top Floor w/ Views,t,Pacific Heights,37.78974,-122.42919,358.00 ,2,North of Downtown
2149,9186305,Serene Golden Gate Park Home,f,Haight-Ashbury,37.7697,-122.45234,80.00 ,1,Western Addition
2150,9187534,"Cozy Mission Victorian Home: Work, Friends, Family",f,Bernal Heights,37.74648,-122.41697,250.00 ,3,Southern
2151,9188845,Private-BD/Shared-BTH in 2-BD/2-BTH TwnHse,t,Bernal Heights,37.73228,-122.41495,75.00 ,2,Southern
