Sr. No.,id,name,host_is_superhost,neighbourhood,latitude,longitude,price in USD,guests_included,Region
5593,27832283,Amazing room in the Outer Richmond district!,f,Richmond District,37.77729,-122.50277,100.00 ,2,Outside Lands
5594,27833309,"Spacious Loft near Moscone, Downtown and ATT park",f,SoMa,37.77559,-122.4024,311.00 ,2,Southern
5595,27834918,San Francisco Apartment,f,SoMa,37.7776,-122.4145,125.00 ,1,Southern
5596,27838782,"San Francisco, Inner Richmond, comfort home.",f,Richmond District,37.78473,-122.4694,150.00 ,1,Outside Lands
5597,27841696,❤️5 Min to GG Park &Haight-Breakfast-Parking Avail,t,Western Addition/NOPA,37.7727,-122.45036,115.00 ,2,Western Addition
5598,27842056,Enjoy fresh pastries in a spacious master suite,t,SoMa,37.77136,-122.40262,160.00 ,2,Southern
5599,27852325,Land''s End Retreat,t,Richmond District,37.77933,-122.51015,94.00 ,1,Outside Lands
5600,27855141,Chez Beaumont,f,Richmond District,37.7787,-122.4554,325.00 ,1,Outside Lands
5601,27857184,The Richmond House II,t,Richmond District,37.78057,-122.46676,275.00 ,6,Outside Lands
5602,27866104,Golden Gate park spacious sunny lovely rm-UCSF,f,Outer Sunset,37.76341,-122.4789,54.00 ,1,Southern
5603,27872617,Suite in Boutique Hotel for Dreamforce,f,Downtown,37.78788,-122.41224,"1,050.00 ",1,Downtown
5604,27895671,Cozy Noe Valley Studio,t,Noe Valley,37.74744,-122.43262,155.00 ,2,Southern
5605,27898470,Spacious Mission Apartment + Parking,f,Mission District,37.76452,-122.4122,200.00 ,1,Southern
5606,27899334,"3 Bed 3 Bath for rent in Bernal Heights, near BART",f,Bernal Heights,37.73379,-122.42568,100.00 ,1,Southern
5607,27900137,Spacious home with huge serene garden,f,Bayview,37.72991,-122.39621,250.00 ,1,Southern
5608,27901261,Cozy room #4 by Subway &Golden Gate Pk. Ez parking,t,Outer Sunset,37.76136,-122.4921,62.00 ,1,Southern
5609,27903069,Sunny Upper Floor Flat in an Authentic Neighborhood,t,Portola,37.72872,-122.40812,399.00 ,6,Southern
5610,27905010,Relax in the Extensive Library at a Pacific Heights Hideaway,t,Pacific Heights,37.78825,-122.44592,199.00 ,2,North of Downtown
5611,27909437,Sunny Mission Dolores Apartment,f,Mission District,37.76284,-122.4253,750.00 ,1,Southern
5612,27926531,Beautiful Light-filled bed/bath with Spanish Steps,f,Marina,37.80218,-122.44124,150.00 ,1,North of Downtown
5613,27928375,Pacific Heights Victorian Home Bedroom & Bathroom,t,Pacific Heights,37.78956,-122.44705,125.00 ,2,North of Downtown
5614,27932896,Modern Furnished 4 bedroom Mission District,f,Mission District,37.74918,-122.41807,378.00 ,4,Southern
5615,27933930,West Portal Guest Studio,t,West Portal,37.74188,-122.46344,112.00 ,1,Outside Lands
5616,27934189,Spacious apartment with downtown views,t,Potrero Hill,37.76435,-122.39701,550.00 ,1,Southern
5617,27934464,"Beautiful & Cozy, Private Entrance Garden SF 1Bdrm",f,Marina,37.80319,-122.43766,136.00 ,1,North of Downtown
5618,27937727,Charming Nob Hill Room with Private Terrace,f,Nob Hill,37.79226,-122.40968,190.00 ,2,Downtown
5619,27937740,Newly-Remodeled Contemporary 2Bdr SF Flat,f,Marina,37.80361,-122.43781,242.00 ,1,North of Downtown
5620,27938375,Little Italy,f,Nob Hill,37.79211,-122.40991,150.00 ,1,Downtown
5621,27939041,Spacious Multi-Level House w-Gorgeous Decks/Views,t,Bernal Heights,37.74516,-122.41938,299.00 ,4,Southern
5622,27957339,Victorian Garden SWEET with private entrance.,t,The Castro,37.7595,-122.43297,140.00 ,1,Western Addition
5623,27959555,Charming Russian Hill 2 Bed 2 Bath,f,Russian Hill,37.80172,-122.42283,210.00 ,1,North of Downtown
5624,27960744,Private Serene Garden Guest Suite with Breakfast,f,Duboce Triangle,37.76702,-122.43518,199.00 ,1,Western Addition
5625,27961418,Foggy San Francisco Suite,t,Sunnyside,37.74236,-122.45425,120.00 ,2,Western Addition
5626,27961487,Killer Views of San Francisco from a Private Apartment,f,Sunnyside,37.73102,-122.43889,200.00 ,1,Western Addition
5627,27963021,Walkable Studio in Iconic Nob Hill,f,Nob Hill,37.79162,-122.40754,118.00 ,1,Downtown
5628,27980774,Castro Retreat,t,The Castro,37.75804,-122.44041,175.00 ,1,Western Addition
5629,27982895,Private 1BR in newly remodeled Inner Sunset home,t,Inner Sunset,37.7571,-122.47448,500.00 ,2,Western Addition
5630,27984599,Large room #3. Subway&Golden Gate Pk. Easy parking,t,Outer Sunset,37.76251,-122.49095,85.00 ,1,Southern
5631,27987585,3BR Condo Next to Golden Gate Park,t,Western Addition/NOPA,37.77355,-122.45329,244.00 ,1,Western Addition
5632,27987824,Delightful 2BR Condominium in San Francisco,t,North Beach,37.79832,-122.41076,209.00 ,1,Downtown
5633,27989150,"Private BR w/en suite BA, modern home, ocean views",t,Inner Sunset,37.75713,-122.47397,500.00 ,1,Western Addition
5634,28004855,Lux 1BR Apt in Hi-Rise w/free wifi,f,South Beach,37.79255,-122.39295,215.00 ,1,Southern
5635,28005003,Lux 1BR Apt in Hi-Rise w/free wifi,f,South Beach,37.79121,-122.39274,215.00 ,1,Southern
5636,28005089,Lux 1BR Apt in Hi-Rise w/free wifi,f,South Beach,37.79057,-122.39289,215.00 ,1,Southern
5637,28007148,"Bright, Comfy Master Bedroom with ensuite Bath",f,Outer Sunset,37.75013,-122.49093,75.00 ,1,Southern
5638,28008682,Lux 1BR Apt in Hi-Rise w/free wifi,f,South Beach,37.79259,-122.39275,215.00 ,1,Southern
5639,28008937,Centrally Located Apartment near BART,t,SoMa,37.77584,-122.41179,172.00 ,1,Southern
5640,28009294,2BR Condominium in San Francisco,t,Western Addition/NOPA,37.78716,-122.42205,215.00 ,1,Western Addition
5641,28009722,Hayes Valley Work Ready Private Room and Bath,t,Hayes Valley,37.77476,-122.42608,135.00 ,1,Western Addition
5642,28028464,Walk to Golden Gate Park from a Radiant Home,t,Cole Valley,37.76574,-122.45702,450.00 ,1,Western Addition
5643,28047393,Large Modern Castro View Home,f,The Castro,37.76022,-122.44413,"3,000.00 ",1,Western Addition
5644,28050674,Lovely Hotel Style Suite - Heart of Union Square,t,Union Square,37.79009,-122.4073,95.00 ,1,Downtown
5645,28053384,Your home away from home in San Francisco!,f,Outer Sunset,37.74275,-122.48729,60.00 ,2,Southern
5646,28055711,Sunny&Quiet* TOP LOCATION* BDR+ BTHR,t,Mission District,37.75915,-122.41056,200.00 ,1,Southern
5647,28057844,"A Convenient, Cheap, Cozy Bedroom at SOMA",t,SoMa,37.77263,-122.40318,100.00 ,1,Southern
5648,28073566,Lux 1BR Apt in Hi-Rise w/free wifi,f,South Beach,37.79059,-122.39245,215.00 ,1,Southern
5649,28074227,Private room & bathroom in Visitacion Valley,f,Visitacion Valley,37.71066,-122.42027,75.00 ,1,Southern
5650,28074409,Stunning Bay View! Prime North Beach Location!,t,North Beach,37.80099,-122.41211,450.00 ,1,Downtown
5651,28079442,Heart of the Mission District - Large 3 Bedroom!,t,Mission District,37.75691,-122.41302,420.00 ,1,Southern
5652,28079540,Wyndham Canterbury at San Francisco 1 bedroom,t,Downtown,37.78937,-122.41364,229.00 ,1,Downtown
5653,28079865,Wyndham Canterbury at San Francisco 1 bedroom,t,Downtown,37.78937,-122.41349,229.00 ,1,Downtown
5654,28081084,Pied-à-terre at Dolores Park,f,Mission District,37.76204,-122.42506,190.00 ,1,Southern
5655,28085987,"Central, open loft with tons of light",t,SoMa,37.77102,-122.42263,750.00 ,2,Southern
5656,28103112,Bright Top Floor Dolores Park Flat,f,Mission District,37.76292,-122.42582,185.00 ,1,Southern
5657,28105604,One of a Kind Home in the ♥ of San Francisco!,t,Pacific Heights,37.79761,-122.42745,599.00 ,2,North of Downtown
5658,28108216,Huge 3 Bedroom Queen Anne Victorian Alamo Sq!,t,Western Addition/NOPA,37.77782,-122.43794,230.00 ,4,Western Addition
5659,28128935,Retreat in the heart of the Mission,f,Mission District,37.76383,-122.42355,175.00 ,1,Southern
5660,28137005,Big Bright Room Open City View,t,Oceanview,37.72082,-122.46345,"1,500.00 ",1,Outside Lands
5661,28139208,Modern-Industrial Suite,t,Mission District,37.74975,-122.41693,280.00 ,1,Southern
5662,28157694,The Perch on Highland...3 BR Farmhouse Elegance,f,Bernal Heights,37.73675,-122.41664,280.00 ,5,Southern
5663,28160772,Mediterranean Oasis In The City (Canto Uccello),t,Noe Valley,37.74847,-122.4237,129.00 ,2,Southern
5664,28164026,Quick Walk to Valencia Street,f,Mission District,37.76016,-122.42277,175.00 ,1,Southern
5665,28178460,Spectacular Marina Blvd Home With Suites,t,Marina,37.80741,-122.436,"1,787.00 ",16,North of Downtown
5666,28181442,Charming Pacific Heights Victorian Getaway Suite,t,Western Addition/NOPA,37.7871,-122.43275,150.00 ,1,Western Addition
5667,28182735,Wyndham Canterbury at San Francisco 1 bedroom,t,Downtown,37.78789,-122.413,229.00 ,1,Downtown
5668,28182805,Wyndham Canterbury at San Francisco 1 bedroom,t,Downtown,37.78789,-122.41395,229.00 ,1,Downtown
5669,28183336,2 Bedroom Condo with Amenities,t,Dogpatch,37.76301,-122.38885,229.00 ,1,Southern
5670,28183364,Modern 2 Bedroom with Gym Access,t,Dogpatch,37.76161,-122.38946,218.00 ,1,Southern
5671,28183375,SF 2 Bedroom with Gated Access,t,Dogpatch,37.76329,-122.38868,218.00 ,1,Southern
5672,28183559,Rustic Charm • Cottage • In heart of city,f,Presidio Heights,37.78717,-122.45139,118.00 ,1,North of Downtown
5673,28184435,2 Bedroom in Lower Pacific Heights,t,Western Addition/NOPA,37.78213,-122.44274,208.00 ,1,Western Addition
5674,28186675,Sunny Victorian 2 Bedroom Suite with Private Bath,t,Duboce Triangle,37.76841,-122.42801,251.00 ,2,Western Addition
5675,28189029,Spacious+Cozy 1Br (4ppl) - Breakfast+Free Parking,t,Outer Sunset,37.74034,-122.47967,112.00 ,2,Southern
5676,28189141,Excelente apto mobiliado e bem localizado em SF,f,Lakeshore,37.71561,-122.49871,145.00 ,1,Outside Lands
5677,28200634,SF Stylish Apt near Presidio & GG Bridge w/ Garage,t,Richmond District,37.78447,-122.48237,175.00 ,4,Outside Lands
5678,28208579,Contemporary Suite on Sunny Potrero Hill,t,Potrero Hill,37.76046,-122.39565,140.00 ,2,Southern
5679,28222183,Master bedroom w/ private bath near Ocean Beach,f,Outer Sunset,37.74318,-122.49908,72.00 ,1,Southern
5680,28226145,Cute garden studio with hot tub in Bernal Heights,t,Bernal Heights,37.73848,-122.41729,108.00 ,1,Southern
5681,28232197,Great condo in bayview only 15 mins from SFO,t,Bayview,37.7327,-122.39122,150.00 ,1,Southern
5682,28251404,Boutique Luxury Home with Garden - Cole Valley,f,Cole Valley,37.76104,-122.44645,350.00 ,1,Western Addition
5683,28259229,Master in 3rd Floor Artists Flat,f,Hayes Valley,37.77149,-122.42872,90.00 ,1,Western Addition
5684,28261064,Relaxing Studio Close to BART Station,t,Sunnyside,37.73287,-122.4377,85.00 ,2,Western Addition
5685,28263206,"Private Room, 3 Twin Beds, Convenient Neighborhood",t,Richmond District,37.77882,-122.46066,400.00 ,1,Outside Lands
5686,28267650,"Cozy South Park Studio, near Caltrain & South Park by Blueground",f,SoMa,37.78147,-122.39603,217.00 ,1,Southern
5687,28276600,Beautiful flat in the Mission,t,Mission District,37.75186,-122.4033,131.00 ,1,Southern
5688,28279424,Classic SF 2 bedroom Apartment,t,SoMa,37.77604,-122.4082,140.00 ,2,Southern
5689,28280458,"Nob hill/Pac heights, clean quiet and close.",f,Pacific Heights,37.79088,-122.42277,156.00 ,2,North of Downtown
5690,28281476,Charming SF 2 Bedroom,t,SoMa,37.77634,-122.40798,145.00 ,2,Southern
5691,28284827,*Prime Location - GG Park & Ocean Beach*,t,Outer Sunset,37.76033,-122.50762,105.00 ,2,Southern
5692,28306183,2 bd/1 ba 2nd floor flat in North Beach,f,Telegraph Hill,37.79981,-122.40621,145.00 ,1,Downtown
5693,28310642,Fantastic Union Square Location - Studio Hotel,t,Union Square,37.79023,-122.40792,95.00 ,1,Downtown
5694,28312747,Private room available for rent!,t,Mission District,37.75302,-122.40478,65.00 ,1,Southern
5695,28315009,"Private room in a cozy, residential area of SF",f,Inner Sunset,37.75918,-122.47359,100.00 ,1,Western Addition
5696,28316938,Bright and Happy Apt with City View Rooftop,t,Lower Haight,37.7721,-122.43856,350.00 ,1,Western Addition
5697,28338036,2 Bedroom Condo in Great Location,t,SoMa,37.77042,-122.41769,201.00 ,1,Southern
5698,28338407,Stylish Room in the heart of Nopa,t,Western Addition/NOPA,37.77605,-122.4398,145.00 ,1,Western Addition
5699,28339483,Mission 1 Bedroom near BART,t,Mission District,37.76879,-122.42402,176.00 ,1,Southern
5700,28360154,Beautiful Spacious 1brm Bernal Heights,t,Bernal Heights,37.74425,-122.41208,147.00 ,1,Southern
5701,28361732,Elegant Home in Historic Victorian,t,Western Addition/NOPA,37.78863,-122.42909,500.00 ,1,Western Addition
5702,28363410,"Sunny, quiet room in elegant Victorian building",t,Mission District,37.75038,-122.41401,94.00 ,1,Southern
5703,28363414,Comfortable home with convenient transportation,f,Mission Terrace,37.71975,-122.44273,90.00 ,1,Outside Lands
5704,28369380,Ocean View Master Suite+Bath-Breakfast+FreeParking,t,Outer Sunset,37.74151,-122.47972,92.00 ,2,Southern
5705,28376750,"Stunning, Private Suite in Tuscan Villa",f,Telegraph Hill,37.79919,-122.40207,199.00 ,1,Downtown
5706,28377944,"Nob Hill / shared room for 2 / hacknsleep,com",f,Nob Hill,37.79139,-122.41775,38.00 ,1,Downtown
5707,28384050,Private Master Suite with Living Room,f,Portola,37.72975,-122.40538,119.00 ,1,Southern
5708,28386585,"Two Private Rooms, Plus Private Bath in Sunny Apt",t,Western Addition/NOPA,37.7786,-122.44244,450.00 ,1,Western Addition
5709,28387261,Private room in Heart of San Francisco,t,Hayes Valley,37.77406,-122.42604,135.00 ,1,Western Addition
5710,28387981,HILLTOP HIDEAWAY,t,Bernal Heights,37.74228,-122.41365,175.00 ,2,Southern
5711,28388893,2 PRIVATE ROOMS + BATH in beautiful Victorian,t,Noe Valley,37.75368,-122.4272,150.00 ,3,Southern
5712,28390797,Spacious Flat in an Elegant Victorian Home near Hayes Valley,f,Alamo Square,37.77623,-122.43051,410.00 ,1,Western Addition
5713,28407357,★ Cozy Hideout-Ace Location-Local Experiences ★,f,Inner Sunset,37.76378,-122.46581,450.00 ,5,Western Addition
5714,28427234,"Stylish SoMa 1BR w/ Gym + Pool + Spa, near SF MOMA, by Blueground",f,SoMa,37.78499,-122.39831,234.00 ,1,Southern
5715,28434902,Nob Hill Gardens Cottage Studio,t,Nob Hill,37.79252,-122.41646,250.00 ,1,Downtown
5716,28435943,"Classic SF. Views! Quiet, UCSF, GG Park, Haight.",f,Cole Valley,37.76442,-122.45453,325.00 ,1,Western Addition
5717,28440838,San Francisco Home with a Spectacular View!,f,The Castro,37.75881,-122.44118,500.00 ,1,Western Addition
5718,28441915,Pac Heights Retreat - 2 bd/ 2ba + gourmet kitchen,t,Pacific Heights,37.78886,-122.44192,425.00 ,4,North of Downtown
5719,28442815,Bright & Airy Edwardian Gem Atop Russian Hill,f,Russian Hill,37.7986,-122.41804,180.00 ,2,North of Downtown
5720,28444017,"Heart of SF! Sunny 2 BR, 2.5 BA with patio",f,The Castro,37.76163,-122.43164,999.00 ,1,Western Addition
5721,28450508,Spacious & Bright Edwardian Gem Atop Russian Hill,f,Russian Hill,37.79715,-122.41905,178.00 ,2,North of Downtown
5722,28458996,SF Penthouse View+Deck Featured in Magazines,t,Pacific Heights,37.79672,-122.42452,"1,000.00 ",1,North of Downtown
5723,28459015,New+Cozy Bedroom w/2 beds+Breakfast & FreeParking,t,Parkside,37.7419,-122.48004,75.00 ,2,Outside Lands
5724,28459122,Classic Architecture/Modern Design in City Center,f,Cole Valley,37.76674,-122.44835,275.00 ,2,Western Addition
5725,28462004,3-Bedroom Victorian w/Parking in Bernal Heights,t,Bernal Heights,37.74376,-122.42229,500.00 ,1,Southern
5726,28462671,Daily City Home with a View,f,Crocker Amazon,37.7088,-122.45527,38.00 ,1,Southern
5727,28464381,"Beautiful, Stylish Mission Apt with Decks + Views",f,Mission District,37.75094,-122.40673,200.00 ,4,Southern
5728,28466654,"Double Suits, 3 queen beds w/ private bath- Ocean",f,Outer Sunset,37.74498,-122.49786,78.00 ,1,Southern
5729,28489872,"Broderick Suite- Private entrance, self check-in.",t,Western Addition/NOPA,37.78053,-122.44022,150.00 ,2,Western Addition
5730,28490107,Stylish Noe Valley home with a view,t,Noe Valley,37.74076,-122.43044,300.00 ,1,Southern
5731,28494293,Inner Mission Sanctuary,f,Mission District,37.76326,-122.42231,500.00 ,1,Southern
5732,28499025,Large private room w/ bath in luxury home (Rm #1),t,Lakeshore,37.73366,-122.47549,115.00 ,2,Outside Lands
5733,28500088,Nat''s Mission Guest Suite,t,Mission District,37.75632,-122.40868,180.00 ,4,Southern
5734,28503911,"Comfy Mission Bay 1BR, w/ A/C, near Muni lightrail by Blueground",f,Mission Bay,37.77557,-122.3898,281.00 ,1,Downtown
5735,28517686,UNION SQUARE-THE DONATELLO HOTEL-SAN FRANCISCO,f,Downtown,37.78865,-122.41148,220.00 ,1,Downtown
5736,28518540,"Central Noe Valley - Updated, Clean & gigabit wifi",t,Noe Valley,37.753,-122.42859,250.00 ,1,Southern
5737,28521528,1BR Apartment in Daly City,t,Crocker Amazon,37.70876,-122.46159,132.00 ,1,Southern
5738,28539243,"Relax into City Living at a Light-Filled, Contemporary Home",t,Ingleside,37.71786,-122.44935,150.00 ,1,Outside Lands
5739,28543140,Mid Market Private Room - (Hidden by Airbnb) Fiber,f,SoMa,37.77994,-122.41054,79.00 ,1,Southern
5740,28544293,2 Bedroom Home in Noe Valley,t,Noe Valley,37.75277,-122.43154,218.00 ,1,Southern
5741,28548553,Indulge yourself in this luxury designer SF home,t,Sunnyside,37.73594,-122.45845,256.00 ,4,Western Addition
5742,28550959,Private Room in Haight Ashbury Victorian Home,t,Haight-Ashbury,37.77075,-122.44944,86.00 ,1,Western Addition
5743,28560838,Quintessential San Francisco Luxury Apartment,f,Telegraph Hill,37.80143,-122.40527,600.00 ,1,Downtown
5744,28563068,Entire bottom level in the heart of the mission,f,Mission District,37.76646,-122.41749,150.00 ,1,Southern
5745,28569210,Sunny 1bdr overlooks Alamo Square,f,Western Addition/NOPA,37.7765,-122.43584,125.00 ,1,Western Addition
5746,28581080,Sunny Mission/Bernal Room for October Sublet,f,Noe Valley,37.74722,-122.42361,75.00 ,1,Southern
5747,28582487,Stylish SF Apartment in SoMa/Design District,t,SoMa,37.77086,-122.40459,275.00 ,1,Southern
5748,28588615,"Gorgeous, Master Suite in Tuscan Villa",f,Telegraph Hill,37.79968,-122.40343,199.00 ,1,Downtown
5749,28589423,"Breathtaking, Private Suite in Tuscan Villa",f,Telegraph Hill,37.80013,-122.40219,199.00 ,1,Downtown
5750,28603195,Entire Guest Suite in San Francisco home,f,Balboa Terrace,37.73109,-122.45617,300.00 ,1,Western Addition
5751,28633744,"Luxury Private Room, Bathroom, Living Room & Yard",t,Noe Valley,37.74985,-122.43519,440.00 ,2,Southern
5752,28635140,Bernal Heights Contemporary Condo | Private Room,f,Bernal Heights,37.73356,-122.41362,48.00 ,2,Southern
5753,28639182,Girls shared room in Daily City SF (one bed only),f,Crocker Amazon,37.7086,-122.45432,40.00 ,1,Southern
5754,28646377,The Heart of SF,f,Financial District,37.79647,-122.3974,280.00 ,1,Downtown
5755,28660479,Wyndham Canterbury at San Francisco 1 bedroom,t,Downtown,37.78827,-122.41179,229.00 ,1,Downtown
5756,28660694,Wyndham Canterbury at San Francisco 1 bedroom,t,Downtown,37.78956,-122.4117,229.00 ,1,Downtown
5757,28667341,New Mission-Bernal Sanctuary with Great City Views,t,Bernal Heights,37.73999,-122.42294,250.00 ,1,Southern
5758,28668662,Centrally Located Modern Nob Hill 1BR Apartment,f,Nob Hill,37.79267,-122.41834,150.00 ,1,Downtown
5759,28668842,Marina 1 Bedroom near Shops and Restaurants,t,Marina,37.80239,-122.44138,172.00 ,1,North of Downtown
5760,28674015,Master suite available near Ocean Beach,t,Outer Sunset,37.74801,-122.50653,120.00 ,1,Southern
5761,28683064,"Bright room in the heart of SF, steps from Dolores",f,Mission District,37.75931,-122.42384,300.00 ,1,Southern
5762,28696499,#3 Private room with private bathroom,t,Parkside,37.74769,-122.47802,100.00 ,1,Outside Lands
5763,28712209,Shipyard Condo,f,Bayview,37.72863,-122.36857,200.00 ,1,Southern
5764,28712636,Explore Golden Gate Park from a Sophisticated Home,t,Outer Sunset,37.76047,-122.49201,300.00 ,4,Southern
5765,28714327,Great Views! 2 Bedrms/2Bathrm House - glen pk bart,f,Sunnyside,37.72995,-122.44027,250.00 ,4,Western Addition
5766,28715601,Spacious 3 Bedroom Mission District w/ Local Flair,f,Mission District,37.75909,-122.40889,325.00 ,1,Southern
5767,28716670,"Large Room  , Inner Sunset, Golden Gate Park, UCSF",f,Inner Sunset,37.76061,-122.46237,60.00 ,1,Western Addition
5768,28718646,Inner mission hideaway,f,Mission District,37.76429,-122.4219,350.00 ,1,Southern
5769,28718827,2 Bd Condo w Rooftop Deck and A/C in Mission,t,Mission District,37.76309,-122.41948,240.00 ,1,Southern
5770,28722160,Roomy and Comfortable Suite 2BR/1BA with Backyard!,t,Visitacion Valley,37.71832,-122.40111,135.00 ,2,Southern
5771,28724036,"Comfy SoMa 1BR, w/Gym + Doorman, near Civic Center by Blueground",f,SoMa,37.77843,-122.41272,207.00 ,1,Southern
5772,28733771,Sunny room with full-size bed in heart of SF,t,Mission District,37.76908,-122.42367,100.00 ,1,Southern
5773,28733881,City View - Big Bright Private Room,t,Oceanview,37.72092,-122.46558,75.00 ,1,Outside Lands
5774,28734043,Sunny room with Queen bed in heart of SF!,t,Mission District,37.76744,-122.42427,110.00 ,1,Southern
5775,28736194,Wyndham Canterbury at San Francisco 1 bedroom,t,Downtown,37.78865,-122.4116,229.00 ,1,Downtown
5776,28736243,Wyndham Canterbury at San Francisco 1 bedroom 1A,t,Downtown,37.7892,-122.41174,229.00 ,1,Downtown
5777,28738369,Luxury one-bedroom close to Dreamforce,f,SoMa,37.7789,-122.41258,500.00 ,1,Southern
5778,28758712,Comfy 1 Bedroom Hotel Style Suite in Union Square,t,Downtown,37.78944,-122.40603,99.00 ,1,Downtown
5779,28760367,Dreamforce only appartment rental,t,Bernal Heights,37.74721,-122.41875,"1,000.00 ",3,Southern
5780,28764476,Instaworthy Views | Downtown | Luxury Complex,t,SoMa,37.77071,-122.40404,120.00 ,2,Southern
5781,28781468,"Surfers Sanctuary, Beachside in San Francisco",f,Outer Sunset,37.75559,-122.50843,100.00 ,1,Southern
5782,28783226,"Fremont Street, 1 Bedroom San Francisco Apartment",f,South Beach,37.78667,-122.39239,219.00 ,1,Southern
5783,28783963,"Folsom Street, 1 Bedroom San Francisco Apartment",f,SoMa,37.78077,-122.40249,209.00 ,1,Southern
5784,28784618,Pacific Heights Victorian Garden Bed and Bath Suite,t,Pacific Heights,37.78821,-122.44657,139.00 ,2,North of Downtown
5785,28794368,SF Guest Room in Local’s Flat,f,Russian Hill,37.79779,-122.41931,200.00 ,1,North of Downtown
5786,28803800,Explore the Mission District from an Artistic Home,t,Mission District,37.75548,-122.40981,100.00 ,4,Southern
5787,28805953,Chic Mission Pad Just a Block From Dolores Park,f,Mission District,37.75803,-122.42386,132.00 ,1,Southern
5788,28807663,Condo only 15 mins from Giants stadium,t,Bayview,37.73293,-122.3928,150.00 ,1,Southern
5789,28811625,Ashbury Heights room with a view of the Pacific,t,Haight-Ashbury,37.76251,-122.44587,62.00 ,1,Western Addition
5790,28836254,Charming 2BR Apartment in San Francisco,t,Duboce Triangle,37.77172,-122.4238,225.00 ,1,Western Addition
5791,28836339,Quiet Oasis in the Marina in San Francisco,f,Marina,37.8015,-122.4417,200.00 ,1,North of Downtown
5792,28836451,Delightful 2BR Apartment in San Francisco,t,Duboce Triangle,37.7718,-122.42503,225.00 ,1,Western Addition
5793,28838194,Luxury SOMA Apartment in exclusive complex,t,SoMa,37.77154,-122.40481,175.00 ,1,Southern
5794,28838371,JARZ House,f,Bernal Heights,37.74569,-122.41637,150.00 ,1,Southern
5795,28839980,The Archive- Private room in SF coliving,f,Mission District,37.76625,-122.42515,76.00 ,1,Southern
5796,28841178,Private Bedroom & bathrm in huge historic mansion,f,Pacific Heights,37.79125,-122.4247,150.00 ,1,North of Downtown
5797,28844783,Private studio located in the heart of the city,f,SoMa,37.77733,-122.41313,575.00 ,2,Southern
5798,28846529,Spacious in-law apartment in sunny Bernal Heights,f,Bernal Heights,37.74394,-122.41364,150.00 ,1,Southern
5799,28869072,Bay & Golden Gate views 2 Bdrm  in Pacific Height,f,Pacific Heights,37.79685,-122.43694,268.00 ,1,North of Downtown
5800,28869460,Charming San Francisco House,f,Haight-Ashbury,37.77141,-122.44465,56.00 ,1,Western Addition
5801,28874478,Artsy Studio Home - Japantown/Filmore/Alamo Square,f,Western Addition/NOPA,37.78293,-122.43353,99.00 ,1,Western Addition
5802,28895194,Modern Full Apt Studio in San Fran with Views,f,SoMa,37.77787,-122.4154,119.00 ,1,Southern
5803,28898815,Modern Appartment in the heart of the Mission.,t,Mission District,37.76013,-122.42195,85.00 ,1,Southern
5804,28919893,"Charming entire house(2nd floor) by GGP , Ocean",f,Richmond District,37.77191,-122.50827,220.00 ,2,Outside Lands
5805,28920042,Remodeled Studio w/ PARKING by Golden Gate Park,t,Richmond District,37.77393,-122.48702,139.00 ,1,Outside Lands
5806,28932960,Private cozy room,f,Outer Sunset,37.75743,-122.50077,70.00 ,1,Southern
5807,28935709,Former Chocolate Factory Turned Two-bedroom Luxury Condo,f,Fisherman''s Wharf,37.80586,-122.42238,"1,249.00 ",1,North of Downtown
5808,28935882,#2 Private room with private bathroom with tub,t,Parkside,37.74823,-122.47707,118.00 ,1,Outside Lands
5809,28936671,Charming San Francisco Apartment,f,Hayes Valley,37.77416,-122.42399,110.00 ,1,Western Addition
5810,28958592,Room in San Francisco’s beautiful Nob Hill,f,Nob Hill,37.79344,-122.4121,78.00 ,1,Downtown
5811,28959030,Downtown 1BR Presidential Resort,f,Downtown,37.78787,-122.41171,450.00 ,1,Downtown
5812,28964034,The Archive - private room in SF coliving house,t,Mission District,37.766,-122.42668,200.00 ,1,Southern
5813,28968228,Chateau Marina garden view room,t,Marina,37.80481,-122.4459,200.00 ,2,North of Downtown
5814,28968247,Chateau Marina Bridgeview Room,t,Marina,37.80496,-122.4439,280.00 ,2,North of Downtown
5815,28968638,"Chateau Marina, Garden View Room 2",t,Marina,37.80432,-122.44442,250.00 ,2,North of Downtown
5816,28968644,Chateau Marina Master room,t,Marina,37.80552,-122.44523,300.00 ,2,North of Downtown
5817,28979474,Bright Modern Victorian in the Heart of Potrero,t,Potrero Hill,37.76343,-122.3975,350.00 ,1,Southern
5818,28984696,Reservation at Waterside Penthouse by Bay Bridge,f,South Beach,37.78867,-122.39103,99.00 ,1,Southern
