Sr. No.,id,name,host_is_superhost,neighbourhood,latitude,longitude,price in USD,guests_included,Region
3766,19315898,2 Blocks away from the lake 6,f,Lakeshore,37.73117,-122.48718,58.00 ,1,Outside Lands
3767,19316565,Comfortable Hotel Style Suite in Union Square,f,Union Square,37.79011,-122.4068,75.00 ,1,Downtown
3768,19316721,2 Blocks away from the lake 4,f,Lakeshore,37.73255,-122.48936,45.00 ,1,Outside Lands
3769,19328446,Private Rm + Ensuite Bath  SoulCycle/Equinox Union,t,Pacific Heights,37.79629,-122.4327,200.00 ,1,North of Downtown
3770,19329448,Private Studio with Piano 1 Block from Park,t,Pacific Heights,37.79197,-122.42977,99.00 ,1,North of Downtown
3771,19331975,Private Loft and Free Parking in Charming SF Home,t,Ingleside,37.719,-122.45254,110.00 ,2,Outside Lands
3772,19332338,Prime Location Large Flat 5 bed / 3 bath,t,Nob Hill,37.79146,-122.417,495.00 ,1,Downtown
3773,19348868,Happy & Sunny Bayview Living - 2BR House ❤️,t,Bayview,37.73522,-122.3889,300.00 ,4,Southern
3774,19363609,Queen Room in Mission Terrace,t,Mission Terrace,37.72326,-122.44063,90.00 ,1,Outside Lands
3775,19364007,Comfortable Room in Mission Terrace,t,Mission Terrace,37.72467,-122.43943,80.00 ,1,Outside Lands
3776,19365066,★Walk Score 90 & Parking★Patio★Laundry★Top Floor,t,Mission Terrace,37.72151,-122.43823,280.00 ,4,Outside Lands
3777,19368789,B1 Quality Cozy Suite 1Br/1Ba Prvt Entry w Parking,f,Lakeshore,37.72863,-122.49153,69.00 ,1,Outside Lands
3778,19388714,Luxurious Bay View Apt in Telegraph Hill,f,Telegraph Hill,37.80176,-122.40607,450.00 ,3,Downtown
3779,19403989,Ocean View in Central Sunset,t,Outer Sunset,37.75661,-122.47669,65.00 ,1,Southern
3780,19404355,Quiet Retreat in a Prime Location in San Francisco,t,Marina,37.79936,-122.44412,335.00 ,2,North of Downtown
3781,19404978,See the Marin Headlands from this lovely 1 bedroom,t,Outer Sunset,37.75574,-122.47759,75.00 ,1,Southern
3782,19407065,Private in-law centrally located,f,Western Addition/NOPA,37.77873,-122.44396,165.00 ,1,Western Addition
3783,19407153,Massive Studio Near Fillmore District w/ Park View,t,Pacific Heights,37.79044,-122.43933,140.00 ,2,North of Downtown
3784,19411476,Modern Luxury in the Heart of the Mission District,t,Mission District,37.7519,-122.41101,84.00 ,1,Southern
3785,19412165,"Cozy room, spacious bath (attached) + garden",f,Crocker Amazon,37.71375,-122.44554,200.00 ,1,Southern
3786,19412179,Potrero Hill-Sunset Views & Free Parking,t,Potrero Hill,37.75469,-122.39967,70.00 ,1,Southern
3787,19413636,Penthouse Living in the Vibrant Mission District,t,Mission District,37.75067,-122.41275,89.00 ,1,Southern
3788,19413966,Modern Living in a Fantastic Location,t,Mission District,37.75228,-122.41137,89.00 ,1,Southern
3789,19416382,Cozy Light Filled Home,f,Bernal Heights,37.73864,-122.41396,140.00 ,4,Southern
3790,19416507,5931 - Gorgeous Light and Airy Bedroom,t,Outer Sunset,37.7635,-122.48012,76.00 ,1,Southern
3791,19417708,L1-Lakeshore Entire Apt2Br/2Ba Prv Entry w Parking,f,Lakeshore,37.73048,-122.4921,150.00 ,1,Outside Lands
3792,19419133,Golden Gate Park 20th av/UCSF Sunny Private Rm,f,Outer Sunset,37.76422,-122.47725,57.00 ,1,Southern
3793,19423296,shared room in SoMa/1mon,f,SoMa,37.77237,-122.41783,30.00 ,1,Southern
3794,19432832,RUSSIAN HILL / NORTH BEACH ELEGANT FURNISED,f,Russian Hill,37.80073,-122.41545,264.00 ,1,North of Downtown
3795,19437035,Family-friendly home with ocean views,f,Outer Sunset,37.75114,-122.4949,280.00 ,1,Southern
3796,19437156,*Spring Special! Historic 2BR Gem in Heart of SF,f,Western Addition/NOPA,37.78009,-122.44141,149.00 ,1,Western Addition
3797,19438546,The Heavenly Hideaway,f,Potrero Hill,37.76112,-122.40399,190.00 ,2,Southern
3798,19442370,"2352 - Triple Room @ Daly City BART, Freeway, SFO",f,Crocker Amazon,37.71001,-122.46168,65.00 ,2,Southern
3799,19459929,Spacious ArtDeco 1BR nr Golden Gate Park fast wifi,t,Richmond District,37.77863,-122.44731,40.00 ,2,Outside Lands
3800,19461237,Dogpatch Crossroads,f,Potrero Hill,37.75385,-122.39686,150.00 ,3,Southern
3801,19475051,Spacious Comfy Private Room in Richmond SF,f,Richmond District,37.7817,-122.47647,99.00 ,1,Outside Lands
3802,19476963,Lovely Cabins in Daly City,f,Crocker Amazon,37.70875,-122.46423,39.00 ,2,Southern
3803,19478755,Cozy room in Parkside house,t,Inner Sunset,37.74868,-122.47502,95.00 ,1,Western Addition
3804,19484758,Comfy Coastal Flat with Great Garden Views,t,Outer Sunset,37.75549,-122.50206,128.00 ,2,Southern
3805,19491887,Cozy private studio,t,Portola,37.72071,-122.40903,65.00 ,2,Southern
3806,19499099,TINY HOUSE ON NOB HILL,t,Nob Hill,37.79543,-122.41067,325.00 ,2,Downtown
3807,19504960,Sunny modern Victorian with garden,f,Mission District,37.75422,-122.41697,250.00 ,2,Southern
3808,19506419,Spacious 1 Bed Pac Hghts Apartment on Park,f,Pacific Heights,37.789,-122.43883,175.00 ,1,North of Downtown
3809,19507829,Dolores Modern Luxe Designer Penthouse ★★★★★,f,The Castro,37.7613,-122.43024,375.00 ,1,Western Addition
3810,19564659,Full Condo - bright Edwardian Oasis!!,f,Mission District,37.75194,-122.41038,120.00 ,1,Southern
3811,19570262,1920s renovated Craftsman charmer in Ingleside,f,Ingleside,37.71893,-122.45478,165.00 ,6,Outside Lands
3812,19570849,Modern One Bedroom Suite - convenient location,t,Sunnyside,37.74313,-122.45211,150.00 ,2,Western Addition
3813,19570882,Glen Park Posh Lux/2 BDRM /Spa BR/Living RM/Parkng,t,Sunnyside,37.73271,-122.4475,250.00 ,5,Western Addition
3814,19572542,2  blocks away from the lake. # 3,f,Lakeshore,37.73112,-122.4876,60.00 ,1,Outside Lands
3815,19573415,Monthly Piravte Room-Shared Bath near Downtown !3,f,SoMa,37.78126,-122.40962,65.00 ,1,Southern
3816,19573930,Baby Blue Beach House- Sunset SF,f,Outer Sunset,37.74489,-122.50391,300.00 ,1,Southern
3817,19586208,3mon/Bunk in coliving/coworking. Heart of Hi-Tech,f,SoMa,37.77322,-122.41655,40.00 ,1,Southern
3818,19586419,Bed in coliving/coworking. Heart of Hi-Tech World,f,SoMa,37.77246,-122.41771,40.00 ,1,Southern
3819,19588004,"Elegant, Large Single Family House near Sea Cliff",f,Richmond District,37.78312,-122.48914,450.00 ,4,Outside Lands
3820,19594008,Renovated Victorian Home with Secluded Front Yard,t,Presidio Heights,37.78322,-122.4505,249.00 ,4,North of Downtown
3821,19596257,Modern Nob Hill Home,f,Downtown,37.78962,-122.41114,150.00 ,4,Downtown
3822,19612051,Golden Gate Park private bath/Master Suite/UCSF,f,Outer Sunset,37.76299,-122.47712,62.00 ,1,Southern
3823,19626323,5934 - Bright & Spacious Master Suite w/ Balcony,t,Outer Sunset,37.76499,-122.47937,75.00 ,2,Southern
3824,19636416,Bird''s Eye View of Golden Gate Bridge,t,Russian Hill,37.79859,-122.41854,214.00 ,2,North of Downtown
3825,19642407,小巧安静的房间,f,Mission Terrace,37.72516,-122.44198,67.00 ,1,Outside Lands
3826,19644702,Modern Nob Hill Lodging,f,Downtown,37.78845,-122.41213,65.00 ,2,Downtown
3827,19658833,Master Suite in Classic San Francisco Edwardian,t,Richmond District,37.77743,-122.47018,150.00 ,2,Outside Lands
3828,19659835,Castro Victorian with City View - Business Ready,f,The Castro,37.75989,-122.43584,162.00 ,1,Western Addition
3829,19680922,Classic 20''s  boutique apt. with charming updates,t,Chinatown,37.79291,-122.408,105.00 ,1,Downtown
3830,19694250,Victorian Condo with Mid Century Modern Style,f,Hayes Valley,37.77121,-122.43266,650.00 ,1,Western Addition
3831,19704114,"Very Clean, Very Private Room near SFO, AT&T Park",t,Bayview,37.71876,-122.39104,101.00 ,2,Southern
3832,19709987,"Sunny Bedroom, Funky Wee Organic Farm",f,Excelsior,37.72697,-122.42767,75.00 ,1,Southern
3833,19715066,"PERFECT location - fun, light, and clean",f,Nob Hill,37.79443,-122.41814,143.00 ,3,Downtown
3834,19720449,Bernal Heights Two Bedroom with Private Access,t,Bernal Heights,37.74568,-122.4112,220.00 ,4,Southern
3835,19721174,Private Luxury Guest Floor @ Heart of Hayes Valley,t,Hayes Valley,37.77693,-122.42451,348.00 ,2,Western Addition
3836,19721472,Private home in charming West Portal neighborhood,f,Parkside,37.73859,-122.4723,410.00 ,1,Outside Lands
3837,19721524,House in the heart of sunny Bernal Heights.,f,Bernal Heights,37.73882,-122.41351,300.00 ,4,Southern
3838,19745324,4600 SQ FT SEA CLIFF Mansion,f,Richmond District,37.78648,-122.48868,400.00 ,8,Outside Lands
3839,19753187,Dolores Park 3BR Sweet Spot in the Mission,t,Mission District,37.75984,-122.42639,325.00 ,2,Southern
3840,19780176,Nob Hill Studio Condo - Great Location,t,Chinatown,37.79084,-122.40685,250.00 ,1,Downtown
3841,19782416,Portsmouth Square Pied a Terre,f,Chinatown,37.79611,-122.4051,140.00 ,2,Downtown
3842,19808052,Large King Bedroom w/ Shared Bath near Marina,t,Cow Hollow,37.7975,-122.43626,109.00 ,1,North of Downtown
3843,19808652,inner richmond one bedroom one bath apt.,f,Richmond District,37.7792,-122.46975,90.00 ,1,Outside Lands
3844,19810694,Cozy apartment in a nice neighborhood,f,Pacific Heights,37.79005,-122.4308,150.00 ,1,North of Downtown
3845,19813532,2 blocks away from the lake 5,f,Lakeshore,37.73325,-122.4871,45.00 ,1,Outside Lands
3846,19813606,Private 1 BDR in the Heart of SF!,f,Pacific Heights,37.79305,-122.42482,150.00 ,2,North of Downtown
3847,19824550,"Newly Remodeled Room, Center of San Francisco",t,Tenderloin,37.78431,-122.42014,150.00 ,2,Downtown
3848,19827064,Modern Hotel Room with Classic SF Feel,f,Chinatown,37.79098,-122.40625,700.00 ,1,Downtown
3849,19827923,Bright Top Floor Studio by Union Square!,f,Tenderloin,37.7843,-122.41492,87.00 ,1,Downtown
3850,19828648,Cozy room with bus to downtown & airport,f,Mission Terrace,37.72644,-122.44199,78.00 ,1,Outside Lands
3851,19829202,Charming Top Floor Remodeled Studio,f,Tenderloin,37.78444,-122.41591,80.00 ,1,Downtown
3852,19830610,DOGPATCH CREATIVE FLAT,f,Dogpatch,37.75615,-122.38776,280.00 ,2,Southern
3853,19849615,2  blocks away from the lake. 2,f,Lakeshore,37.73163,-122.48718,45.00 ,1,Outside Lands
3854,19849866,Nob Hill Studio Condo - Convenient For Conventions,t,Chinatown,37.79148,-122.40637,225.00 ,1,Downtown
3855,19865320,Fully furnished 2 Bedroom +office in Lower Pac Hts,f,Western Addition/NOPA,37.78691,-122.4389,189.00 ,1,Western Addition
3856,19872447,New building luxury 3BR/2BTH-near Mission St,f,Mission Terrace,37.72595,-122.43705,275.00 ,3,Outside Lands
3857,19877901,Nice little room to explore San Francisco,f,Crocker Amazon,37.71234,-122.43747,121.00 ,2,Southern
3858,19878899,Cozy private room and bathroom in Bernal heights,t,Bernal Heights,37.73695,-122.41109,63.00 ,1,Southern
3859,19891811,SF skyline of the top floor Apt6  1bed(+2)/1baths,f,Visitacion Valley,37.71975,-122.40178,180.00 ,1,Southern
3860,19892991,Best Cozy Comfy Twin Peak Home,t,Twin Peaks,37.74895,-122.44704,300.00 ,4,Western Addition
3861,19894058,SF skyline of the first floor Apt5C 1bed/1baths.,f,Visitacion Valley,37.7197,-122.40086,70.00 ,1,Southern
3862,19904931,Centrally Located Studio,f,Nob Hill,37.79659,-122.41603,80.00 ,1,Downtown
3863,19905527,Overlook the Golden Gate Bridge Through Walls of Windows,t,Richmond District,37.78623,-122.49342,"3,394.00 ",7,Outside Lands
3864,19907178,Entire Flat in SOMA - central to everything,t,SoMa,37.77746,-122.4083,249.00 ,1,Southern
3865,19909235,Bedroom w/Private Bath in Modern Mission Apartment,f,Mission District,37.7514,-122.40902,150.00 ,1,Southern
3866,19914814,2BR Apartment Near Union Square,t,Nob Hill,37.79477,-122.41303,182.00 ,1,Downtown
3867,19916751,Financial District Next to Farmers Market,f,Financial District,37.79557,-122.39842,130.00 ,1,Downtown
3868,19922726,Castro Guest Suite with Private Living Room,t,The Castro,37.75983,-122.43527,188.00 ,2,Western Addition
3869,19924936,Newly remodeled one bedroom in San Francisco,t,Richmond District,37.77762,-122.45973,100.00 ,1,Outside Lands
3870,19927986,2 Rooms near BART Stop & 15 mins to SFO,f,Excelsior,37.73095,-122.42726,90.00 ,1,Southern
3871,19931498,Apartment with Stunning City Views,t,Nob Hill,37.79685,-122.41116,157.00 ,1,Downtown
3872,19931606,Apartment with Cable Car Views,t,SoMa,37.77446,-122.41849,150.00 ,1,Southern
3873,19933216,WALK TO ALL! AMAZING MISSION 2BR W/ PRIVATE DECK,t,Mission District,37.76398,-122.42383,400.00 ,4,Southern
3874,19934941,"1BR, Nob Hill top floor unit with spectacular view",t,Nob Hill,37.7934,-122.41486,164.00 ,1,Downtown
3875,19946179,Hip and cozy house in SF''s best neighborhood,f,Inner Sunset,37.76171,-122.46836,395.00 ,1,Western Addition
3876,19946354,"Beautiful Designer Flat, Modern and Spacious",t,Bernal Heights,37.74468,-122.42065,320.00 ,1,Southern
3877,19949962,Luxurious & Spacious SF 2 Bdr Penthouse,f,Marina,37.80318,-122.43837,250.00 ,4,North of Downtown
3878,19950230,"Stylish, private & quiet in Potrero Hill",f,Potrero Hill,37.75461,-122.40226,275.00 ,1,Southern
3879,19954872,"311E Private Room in Super Convenient Area, Room E",f,Richmond District,37.78345,-122.46331,90.00 ,2,Outside Lands
3880,19969592,Stunning view home in fantastic neighborhood!,t,Bernal Heights,37.74591,-122.41013,400.00 ,4,Southern
3881,19985392,Victorian Flat in the Haight Ashbury,f,Haight-Ashbury,37.77014,-122.44521,450.00 ,6,Western Addition
3882,19995782,Cozy Flat Near Alamo Square,f,Western Addition/NOPA,37.77483,-122.43406,150.00 ,1,Western Addition
3883,20012065,"Family home in SF, two floors, 2br 2ba, sleeps 4+",f,Forest Hill,37.74559,-122.45882,300.00 ,4,Outside Lands
3884,20024608,Nob Hill Timeshare Studio Condo - Great Location,t,Chinatown,37.79124,-122.40645,250.00 ,1,Downtown
3885,20059569,"311A Private Room in Super Convenient Area, Room A",f,Richmond District,37.78359,-122.46353,80.00 ,2,Outside Lands
3886,20068624,Folsom St - SOMA Loft with Parking,f,SoMa,37.7791,-122.40579,165.00 ,1,Southern
3887,20070540,Beautiful room with jaw-dropping views!,f,Glen Park,37.73877,-122.42885,120.00 ,2,Southern
3888,20072374,Top Floor Efficiency Studio in the Mission,f,Mission District,37.76522,-122.41834,68.00 ,1,Southern
3889,20073990,Bright and Comfortable 1 Bedroom in the Sunset!,f,Outer Sunset,37.76175,-122.49367,85.00 ,1,Southern
3890,20074013,Spacious Victorian Master Bedroom in Russian Hill,f,Russian Hill,37.80065,-122.42368,185.00 ,1,North of Downtown
3891,20077154,Small & Cozy,f,Mission Terrace,37.7255,-122.44042,94.00 ,1,Outside Lands
3892,20087573,Stunning 1BR in Hayes Valley by Sonder,f,Lower Haight,37.77065,-122.42775,148.00 ,2,Western Addition
3893,20093004,Castro/Noe Valley 4 bedroom flat-- Old Listing,f,Western Addition/NOPA,37.7779,-122.43643,485.00 ,1,Western Addition
3894,20096735,"Centrally located, quiet 1BD apartment",f,Alamo Square,37.77469,-122.43339,220.00 ,2,Western Addition
3895,20119616,"Glitzy, Glamorous, and Full of Grand Spaces",f,Russian Hill,37.80303,-122.42098,196.00 ,1,North of Downtown
3896,20126616,Elegant and Eclectic Townhouse with Victorian Charm,t,Mission District,37.75466,-122.41197,445.00 ,1,Southern
3897,20149972,Well-appointed SOMA penthouse loft in heart of SF,t,South Beach,37.7823,-122.39483,275.00 ,1,Southern
3898,20154622,Cozy Room in the Garden District with Breakfast,t,Portola,37.72361,-122.40863,90.00 ,1,Southern
3899,20155597,Great Neighborhood Close to Everything w Parking,t,Pacific Heights,37.79364,-122.4231,299.00 ,5,North of Downtown
3900,20155822,Charming 1 BR in the Heart of Nob Hill,t,Nob Hill,37.79434,-122.41297,150.00 ,1,Downtown
3901,20156650,Private Bedroom across from Cow Palace 1,f,Visitacion Valley,37.70991,-122.41966,90.00 ,1,Southern
3902,20157395,"Clean, comfortable room w/ free parking",t,Oceanview,37.7118,-122.45812,99.00 ,2,Outside Lands
3903,20167369,Modern private room near waterfront w spa amenity,t,SoMa,37.78914,-122.39455,99.00 ,1,Southern
3904,20169868,"Private, Remodeled Home Close to Golden Gate Park",t,Outer Sunset,37.76252,-122.50516,135.00 ,2,Southern
3905,20173537,SF skyline of 1 floor studio room 1bed(+1)/1baths.,f,Visitacion Valley,37.71971,-122.40058,90.00 ,2,Southern
3906,20190537,Downtown Remodeled Penthouse,f,Downtown,37.7886,-122.42079,89.00 ,1,Downtown
3907,20194233,Savor Incredible Terrace Views from a Bright Home,t,The Castro,37.75567,-122.43394,233.00 ,4,Western Addition
3908,20195883,Serene Retreat in Lone Mountain with Breathtaking Views,t,Richmond District,37.7796,-122.45442,280.00 ,2,Outside Lands
3909,20206679,Bunk in coliving/coworking. Heart of Hi-Tech World,f,SoMa,37.77375,-122.41784,40.00 ,1,Southern
3910,20217846,Luxury Master br in the ❤️ of San Francisco,f,SoMa,37.7761,-122.41565,100.00 ,1,Southern
3911,20230882,Luxury Apartment Building Could be Your Home,f,Nob Hill,37.79093,-122.40851,136.00 ,1,Downtown
3912,20236862,Bright private studio + bath + patio with a view,t,Inner Sunset,37.7548,-122.45677,135.00 ,1,Western Addition
3913,20242206,"!Ground W, White 2 queen beds w/Private bath",f,Excelsior,37.71699,-122.43194,80.00 ,4,Southern
3914,20250782,Cole Valley Queen,f,Cole Valley,37.76763,-122.44968,85.00 ,1,Western Addition
3915,20256864,Modern Room Near Golden Gate Park (White),t,Richmond District,37.77233,-122.5026,73.00 ,2,Outside Lands
3916,20257125,Outer Sunset Private Bedroom [K],f,Outer Sunset,37.74583,-122.49027,99.00 ,2,Southern
3917,20257216,5933 - Sunny and Spacious Room With Private Bath,t,Outer Sunset,37.76329,-122.47868,80.00 ,1,Southern
3918,20258481,Bedroom in Clean Shared House w/ Cats & Small Dog,f,Inner Sunset,37.76229,-122.47402,125.00 ,1,Western Addition
3919,20267540,Home in the vibrant NOPA neighborhood w/Parking!,t,Western Addition/NOPA,37.77687,-122.44095,100.00 ,2,Western Addition
3920,20268056,Cozy Cole Valley Single Room,f,Cole Valley,37.76796,-122.44865,75.00 ,1,Western Addition
3921,20269012,Ocean Beach Bungalow Studio,t,Outer Sunset,37.75729,-122.50367,140.00 ,1,Southern
3922,20269251,"Potrero Hill Mid-Century Modern, 1 BR with Views.",t,Potrero Hill,37.7605,-122.40088,275.00 ,2,Southern
3923,20269328,Double Deluxe R-7 w/ Shared Bath,f,Tenderloin,37.78528,-122.41477,100.00 ,1,Downtown
3924,20279076,"Nob Hill Timeshare Rental Condo - Sleeps 4, 2 Bath",t,Chinatown,37.79097,-122.40678,300.00 ,1,Downtown
3925,20281663,Lovely SF Bdrm/Bath near the Beach.,t,Richmond District,37.78023,-122.50665,130.00 ,1,Outside Lands
3926,20286716,Outer Sunset Private Bedroom [S],f,Outer Sunset,37.74444,-122.49098,99.00 ,2,Southern
3927,20286823,Room in Victorian Home in the Heart of the Mission,t,Mission District,37.75511,-122.41817,98.00 ,1,Southern
3928,20286868,Outer Sunset Private Master Suite [J],f,Outer Sunset,37.74465,-122.48948,125.00 ,2,Southern
3929,20287325,"Red Victorian - Private suite w/bath, Gigi''s",f,Haight-Ashbury,37.76902,-122.45072,100.00 ,1,Western Addition
3930,20302991,Modern Full  Floor NOPA Flat,f,Western Addition/NOPA,37.77211,-122.44822,150.00 ,1,Western Addition
3931,20305889,Modern House with Fantastic Views,t,Bernal Heights,37.74257,-122.41311,280.00 ,1,Southern
3932,20309567,3 bedrooms & private bath in Cole Valley Victorian,f,Cole Valley,37.7672,-122.44952,250.00 ,1,Western Addition
3933,20311264,Long Term Rental:  One-Bedroom Home in the Mission,f,Mission District,37.74861,-122.40885,275.00 ,2,Southern
3934,20321045,Classic One BR Apartment - Nob Hill,t,Nob Hill,37.79007,-122.41479,148.00 ,1,Downtown
3935,20331337,"Quiet, minimalist guest room in playful home.",f,Lower Haight,37.77249,-122.43543,10.00 ,1,Western Addition
3936,20331804,Comfortable Victorian Bedroom in Mission,t,Bernal Heights,37.74479,-122.41977,0.00 ,1,Southern
3937,20355620,2nd Master Bedroom in large 2 story house,f,Bernal Heights,37.74012,-122.40879,113.00 ,1,Southern
3938,20361588,"SUPER CLEAN, Comfy 1 BR, Private entrance, Parking",t,Balboa Terrace,37.72815,-122.46154,225.00 ,2,Western Addition
3939,20361695,3BR Pet-friendly Marina House on Moscone Park,f,Marina,37.80121,-122.43156,215.00 ,1,North of Downtown
3940,20364980,Bliss in Bayview - 4 beds/3 baths with parking,f,Bayview,37.72835,-122.38484,225.00 ,4,Southern
3941,20365435,SF skyline of 1 floor Apt5A  1bed/1baths.,f,Visitacion Valley,37.71989,-122.40003,70.00 ,1,Southern
3942,20365447,"Dream Room at Bliss, Ensuite bath",f,Bayview,37.72851,-122.39085,57.00 ,1,Southern
3943,20367610,Walk/Bike Score 95+ Netflix Fast wifi/ kitchen,t,Parkside,37.7471,-122.47862,40.00 ,1,Outside Lands
3944,20367796,Walk/Bike Score 95+ | full kitchen| 2 Bathrooms,t,Outer Sunset,37.7466,-122.47917,40.00 ,1,Southern
3945,20367880,Walkable Backyard  Fast WiFi/2 bathrooms,t,Outer Sunset,37.74506,-122.47727,50.00 ,2,Southern
3946,20368086,❤ of SF Sunset District | Walk+Bike Score 96+,t,Outer Sunset,37.74657,-122.47787,50.00 ,2,Southern
3947,20386464,Close to everything with a garden oasis,t,Noe Valley,37.74966,-122.43298,295.00 ,1,Southern
3948,20393341,Newly Remodeled Guest Suite with Self-Check in,t,The Castro,37.761,-122.44489,135.00 ,2,Western Addition
3949,20397022,Designer showplace bright colorful room,t,Marina,37.80389,-122.4448,140.00 ,1,North of Downtown
3950,20399118,Upscale  Private Master Suite & Bath,t,Lakeshore,37.73338,-122.47376,180.00 ,2,Outside Lands
3951,20408154,"Nice room, walk to Golden Gate Park",t,Outer Sunset,37.75747,-122.48785,120.00 ,1,Southern
3952,20408951,EXCEPTIONAL RUSSIAN HILL HOME: 2Bd/2.5Ba,f,Fisherman''s Wharf,37.80528,-122.41967,500.00 ,4,North of Downtown
3953,20423020,Contemporary 3bed/2bath + deck on Lake St,f,Richmond District,37.78539,-122.47739,330.00 ,1,Outside Lands
3954,20424404,"Full private level-great for families, central BH!",t,Bernal Heights,37.73932,-122.41537,96.00 ,2,Southern
3955,20424542,Comfy Studio near MUNI subway,t,Forest Hill,37.74406,-122.45918,100.00 ,1,Outside Lands
3956,20424773,Master Bedroom with Views in SoMa,t,SoMa,37.77594,-122.41407,150.00 ,1,Southern
3957,20425693,Buena Vista Retreat,t,Haight-Ashbury,37.76675,-122.44065,195.00 ,1,Western Addition
3958,20425974,Modern 1BR/1Bath private unit with free parking,t,Bayview,37.72922,-122.39312,127.00 ,2,Southern
3959,20426651,"Bright, Airy Large Mission Room",t,Mission District,37.75054,-122.40907,97.00 ,1,Southern
3960,20426652,Sonder | Eighth Street | Bohemian 1BR + Gym,f,SoMa,37.77794,-122.4133,139.00 ,2,Southern
3961,20439767,155Rm2 Quiet Cozy Bedroom w/ Private Bath & Entry,f,Portola,37.72271,-122.40442,80.00 ,1,Southern
3962,20440309,Glen Park Garden,f,Glen Park,37.73369,-122.43452,80.00 ,2,Southern
3963,20444584,"Charming Specious  House, Central, Free Parking",t,Lakeshore,37.73404,-122.47484,260.00 ,8,Outside Lands
3964,20450156,"Admire Colorful Art at a Modern, Ensuite Room near Moscone",t,SoMa,37.78159,-122.39678,80.00 ,1,Southern
3965,20460402,"Family Stay -  Renovated, Quiet 3bed/2ba w/Parking",t,Excelsior,37.71745,-122.43378,200.00 ,6,Southern
3966,20468187,Minimalist Suite close to the Financial District,f,Potrero Hill,37.76518,-122.397,143.00 ,2,Southern
3967,20473642,Bright house with ocean views. Bed in shared room.,t,Parkside,37.74476,-122.48127,28.00 ,1,Outside Lands
3968,20478011,Spectacular Noe Valley home,t,Noe Valley,37.74856,-122.43866,299.00 ,3,Southern
3969,20488889,Prentiss - Cortland Bernal Heights 1BEDROOM/1BATH,f,Bernal Heights,37.73767,-122.41144,107.00 ,1,Southern
3970,20497174,SF Hotel Studio: Union Square Gem!,t,Downtown,37.78877,-122.4106,239.00 ,1,Downtown
3971,20500854,Stay in Notable SF Novelist''s Flat,f,Glen Park,37.7364,-122.42823,195.00 ,1,Southern
3972,20501065,Chic Modern 2BR Mission/Potrero *Summer Special!,t,Mission District,37.7578,-122.40896,129.00 ,2,Southern
3973,20501268,Modern design - 2BR/2BA in Mission Dolores,f,Mission District,37.76787,-122.42712,280.00 ,1,Southern
3974,20505903,Gorgeous Master Bedroom in SoMa near Moscone,t,SoMa,37.78182,-122.398,87.00 ,1,Southern
3975,20522951,Cozy Victorian Home in Duboce Triangle,t,Duboce Triangle,37.76854,-122.43021,166.00 ,1,Western Addition
3976,20522974,1 Bedroom Apt Blocks from Golden Gate Park,t,Western Addition/NOPA,37.7758,-122.44153,156.00 ,1,Western Addition
3977,20526049,"Private Bedroom, Living Room and Bathroom",t,Pacific Heights,37.7893,-122.43208,140.00 ,1,North of Downtown
3978,20541727,"Skyline View in Castro, Prime Location",t,The Castro,37.75903,-122.43726,65.00 ,1,Western Addition
3979,20543892,Bright Slice of the Sunset with Private Suite and Deck,t,Outer Sunset,37.75668,-122.49424,100.00 ,1,Southern
3980,20555113,Luxury Crash Pad,f,Twin Peaks,37.75987,-122.44792,65.00 ,1,Western Addition
3981,20558470,Upscale Golden Gate SF Forest View 1 Bedroom,f,Inner Sunset,37.75469,-122.465,99.00 ,1,Western Addition
3982,20563658,Spacious West Portal Home,f,Inner Sunset,37.74253,-122.46451,165.00 ,1,Western Addition
3983,20573374,"Modernized Mission Edwardian, 2 fluffy queen beds",t,Mission District,37.74866,-122.41871,148.00 ,2,Southern
3984,20575733,5932 - Cozy & Charming Bedroom with Private Bath,t,Outer Sunset,37.76346,-122.47932,80.00 ,1,Southern
3985,20583020,Nob Hill Cottage,f,Nob Hill,37.79548,-122.41848,100.00 ,3,Downtown
3986,20591785,Spacious 1 bedroom condo w/ roofdeck in Nob Hill,f,Nob Hill,37.79279,-122.41537,200.00 ,1,Downtown
3987,20608059,"Bright, quiet getaway in the middle of SF.",f,Twin Peaks,37.75395,-122.45344,65.00 ,1,Western Addition
3988,20614171,"private room in Nob Hill/full bed/hacknsleep,com",f,Nob Hill,37.78922,-122.41974,60.00 ,1,Downtown
3989,20614522,"twin/private room in Nob Hill/hacknsleep,com",f,Nob Hill,37.78945,-122.41923,54.00 ,1,Downtown
3990,20620600,Castro Contemporary meets 1920''s Charm,t,The Castro,37.76567,-122.43673,468.00 ,1,Western Addition
3991,20624559,Bright and Airy Modern Studio Nestled in SF Hills,t,The Castro,37.76345,-122.44074,129.00 ,1,Western Addition
3992,20628433,Bunk in coliving/coworking. Heart of Hi-Tech World,f,SoMa,37.77217,-122.41656,40.00 ,1,Southern
3993,20635517,"1900 Edwardian; Noe Vly w/Twin Peaks View, 2 bdrms",f,Noe Valley,37.75376,-122.43565,260.00 ,6,Southern
