Sr. No.,id,name,host_is_superhost,neighbourhood,latitude,longitude,price in USD,guests_included,Region
1,958,"Bright, Modern Garden Unit - 1BR/1B",t,Lower Haight,37.76931,-122.43386,170.00 ,2,Western Addition
2,5858,Creative Sanctuary,f,Bernal Heights,37.74511,-122.42102,235.00 ,2,Southern
3,7918,A Friendly Room - UCSF/USF - San Francisco,f,Cole Valley,37.76669,-122.4525,65.00 ,1,Western Addition
4,8142,Friendly Room Apt. Style -UCSF/USF - San Francisco,f,Cole Valley,37.76487,-122.45183,65.00 ,1,Western Addition
5,8339,Historic Alamo Square Victorian,f,Alamo Square,37.77525,-122.43637,685.00 ,2,Western Addition
6,8567,Lovely 2BR flat Great Location,f,Western Addition/NOPA,37.78471,-122.44555,255.00 ,1,Western Addition
7,8739,"Mission Sunshine, with Private Bath",t,Mission District,37.75919,-122.42237,139.00 ,2,Southern
8,9225,Artful Potrero Separate Floor with Garden,t,Potrero Hill,37.76259,-122.40543,135.00 ,1,Southern
9,10251,Victorian Suite in Inner Mission,t,Mission District,37.75874,-122.41327,265.00 ,4,Southern
10,10820,Haight Buena Vista Park Garden 3BR,f,Lower Haight,37.77187,-122.43859,177.00 ,6,Western Addition
11,10824,Victorian House in Hayes Valley - 3BED-2BA,f,Hayes Valley,37.77355,-122.42436,194.00 ,1,Western Addition
12,10832,Union Square Modern Loft,f,Union Square,37.78574,-122.40798,139.00 ,1,Downtown
13,12041,Sunny/Sunset view room UCSF/USF - San Francisco,f,Haight-Ashbury,37.77019,-122.44594,85.00 ,1,Western Addition
14,12042,Sunny/Sunset view room UCSF/USF - San Francisco,f,Haight-Ashbury,37.76894,-122.44778,85.00 ,1,Western Addition
15,12522,Perfectly located Castro,t,The Castro,37.76075,-122.43032,79.00 ,1,Western Addition
16,12584,"Views, sun, 12 ft ceilings, decks, 2BR work/sleep",t,Cole Valley,37.76203,-122.45455,166.00 ,2,Western Addition
17,14125,Gallery Residence,f,Mission District,37.75491,-122.42246,215.00 ,2,Southern
18,17132,Luxury 2BR suite with waterview,f,South Beach,37.78647,-122.39072,450.00 ,4,Southern
19,18231,Loft-like Apt./Garden (monthly only available),t,Noe Valley,37.74888,-122.42982,107.00 ,2,Southern
20,18904,Tranquil Lower Haight w/pvt bath,t,Hayes Valley,37.77252,-122.43216,110.00 ,1,Western Addition
21,21334,Studio loft on top of Russian Hill,t,Nob Hill,37.7958,-122.41533,125.00 ,1,Downtown
22,21914,A Friendly Room Apt. Style-UCSF/USF-San Francisco,f,Cole Valley,37.7648,-122.45251,65.00 ,1,Western Addition
23,23611,Bernal Heights Gem with Fab Views !,t,Bernal Heights,37.74556,-122.41207,100.00 ,1,Southern
24,23630,Castro Guest Suite With Continental Breakfast,t,The Castro,37.75963,-122.44143,155.00 ,2,Western Addition
25,24450,Atelier Noe 25 Studio in Noe Valley,t,Noe Valley,37.74885,-122.43673,180.00 ,2,Southern
26,24463,"Potrero Hill Nest Quiet, Comfy & Convenient",t,Potrero Hill,37.75645,-122.3991,155.00 ,2,Southern
27,24685,Castro/Haight San Francisco,t,Haight-Ashbury,37.77162,-122.43836,79.00 ,1,Western Addition
28,24723,Apartment-like rooms in PacHeights,t,Western Addition/NOPA,37.78716,-122.43386,195.00 ,4,Western Addition
29,25094,San Francisco''''s Luxury Oasis On Noe,t,Noe Valley,37.74188,-122.43122,150.00 ,1,Southern
30,25463,Modern Zen in the Lower Haight,t,Alamo Square,37.77729,-122.43421,110.00 ,1,Western Addition
31,25662,"Convenient, quiet, private",t,Potrero Hill,37.76212,-122.39541,125.00 ,2,Southern
32,25927,"CALEF HOUSE Rm 2, Priv Rm in Beaut SF Victorian",t,Western Addition/NOPA,37.78895,-122.43031,110.00 ,1,Western Addition
33,26408,Huge Central Victorian/Alamo Square,f,Alamo Square,37.77478,-122.4315,450.00 ,4,Western Addition
34,27025,"Elegant, Edwardian Apartment in the Castro/Eureka Valley",f,The Castro,37.76298,-122.43136,150.00 ,2,Western Addition
35,27028,Secret Mission Garden,t,Mission District,37.76098,-122.42158,199.00 ,2,Southern
36,29373,Sunny house with garden,t,Bernal Heights,37.73729,-122.41163,220.00 ,5,Southern
37,29557,gigi''''s bed and breakfast,f,Richmond District,37.77931,-122.50518,155.00 ,2,Outside Lands
38,32414,"Cozy, Sunny and Private Space",f,Bernal Heights,37.74025,-122.41259,150.00 ,2,Southern
39,39174,Bette''''s New Place,f,Noe Valley,37.7483,-122.42488,107.00 ,2,Southern
40,39418,"Comfortable Home Base, Bernal Heights",f,Bernal Heights,37.74093,-122.42055,94.00 ,2,Southern
41,40092,Cute Private Apt in the hip Mission,t,Mission District,37.76016,-122.41969,108.00 ,2,Southern
42,40138,Peaceful room in yoga teacher''''s colorful apt.,f,Presidio Heights,37.78255,-122.44844,83.00 ,1,North of Downtown
43,41055,Cozy Castro Cottage with Cat,f,The Castro,37.76125,-122.43335,159.00 ,3,Western Addition
44,41172,Sue''''s Place,t,Bernal Heights,37.74083,-122.41763,125.00 ,2,Southern
45,41423,Guest Cottage - SF,f,Glen Park,37.73557,-122.43302,136.00 ,1,Southern
46,41609,Spacious Quiet SF Downtown Retreat,f,Nob Hill,37.79001,-122.41292,170.00 ,2,Downtown
47,42403,Captain''''s Quarters,f,Bernal Heights,37.73356,-122.41851,85.00 ,2,Southern
48,42408,"Crows Nest,Charming Jr. One Bedroom",f,Bernal Heights,37.73404,-122.41781,85.00 ,2,Southern
49,42577,Garden View Hideaway - PET FRIENDLY,f,Dogpatch,37.75447,-122.38813,150.00 ,4,Southern
50,43778,Lyon''''s Den,f,Haight-Ashbury,37.77272,-122.44084,120.00 ,2,Western Addition
51,44680,Cute Noe/Mission Apartment,f,Mission District,37.75121,-122.42165,175.00 ,2,Southern
52,45299,Private Castro Studio with 2 beds,f,The Castro,37.76068,-122.43331,116.00 ,1,Western Addition
53,45956,Central in SF - Victorian Classic Home - 5 Stars,t,Lower Haight,37.77248,-122.43016,125.00 ,1,Western Addition
54,47486,CACTUS COTTAGE  with easy parking/public transp.,t,Ingleside,37.72536,-122.46861,78.00 ,2,Outside Lands
55,47682,One-bedroom apt.  Lafayette Park,t,Pacific Heights,37.7925,-122.42431,120.00 ,2,North of Downtown
56,48471,Mission Mega Queen Bed Sensation | Safe & Central,f,Mission District,37.75542,-122.40703,76.00 ,1,Southern
57,51073,In the Heart of San Francisco,f,SoMa,37.77116,-122.42199,160.00 ,2,Southern
58,51557,Centrally Located Victorian Apartment,t,Lower Haight,37.77121,-122.42834,119.00 ,2,Western Addition
59,51773,Prime Location - Small Cozy Room,t,Pacific Heights,37.79312,-122.426,55.00 ,1,North of Downtown
60,52713,Nob Hill room with a great view,f,Nob Hill,37.79667,-122.41272,99.00 ,1,Downtown
61,53280,Large & sunny room with bath + yard,t,Bernal Heights,37.73878,-122.41189,90.00 ,1,Southern
62,54518,Financial District Corporate Condo,f,Financial District,37.7933,-122.40079,210.00 ,1,Downtown
63,54634,Studio Apartment Lafayette Park,t,Pacific Heights,37.79166,-122.4265,115.00 ,2,North of Downtown
64,55632,"❤️Stunning Luxury Apt, 5 star reviews, Laundry,",t,Richmond District,37.77959,-122.48619,116.00 ,1,Outside Lands
65,55636,"❤️ Super luxury Apt, Great View,  5 Star Reviews",t,Twin Peaks,37.74889,-122.44479,116.00 ,1,Western Addition
66,56621,Prime Location - Large Private Room,t,Pacific Heights,37.79216,-122.42458,55.00 ,1,North of Downtown
67,57561,"Bernal Heights Apartment, Patio + Parking",f,Bernal Heights,37.7472,-122.41443,175.00 ,2,Southern
68,57676,"Bartlett Gardens: Spacious, bright!",f,Mission District,37.75762,-122.41933,99.00 ,1,Southern
69,58185,Quiet Home in the Trees of Forest Knolls,f,Inner Sunset,37.75504,-122.45871,350.00 ,4,Western Addition
70,59344,Private and Quiet Noe Valley Studio,t,Noe Valley,37.74565,-122.42864,135.00 ,2,Southern
71,59381,Ultra Panoramic View Contemporary,f,Russian Hill,37.8031,-122.41596,109.00 ,1,North of Downtown
72,59702,Garden Cottage Charming!,t,Bernal Heights,37.74209,-122.41409,150.00 ,2,Southern
73,59831,Lovely quiet private room in Home ,f,Outer Sunset,37.75674,-122.49178,100.00 ,2,Southern
74,62519,Lovely Room in Charming Edwardian,t,Noe Valley,37.74183,-122.42993,85.00 ,1,Southern
75,62651,GORGEOUS SAN FRANCISCO HOME,f,Mission District,37.76245,-122.42432,"1,100.00 ",1,Southern
76,63247,Lovely open plan en-suite bed/bath,t,Mission District,37.74926,-122.41398,166.00 ,1,Southern
77,63405,Private Suite in Mission,f,Mission District,37.754,-122.41771,125.00 ,1,Southern
78,64165,Great room in a fantastic location!,t,Marina,37.80317,-122.42874,90.00 ,1,North of Downtown
79,66119,Large garden studio  apt. near Golden Gate Park,f,Richmond District,37.77798,-122.47812,95.00 ,1,Outside Lands
80,66188,Spectacular Sutro Heights,f,Richmond District,37.77719,-122.50906,216.00 ,4,Outside Lands
81,68239,Beautiful 1bdr apt by Dolores Park in Mission,t,Noe Valley,37.75426,-122.42387,326.00 ,2,Southern
82,69410,Private 1BR Inner Richmond Apt,t,Richmond District,37.77442,-122.46319,80.00 ,1,Outside Lands
83,69549,MISSION Outr BedRm3+Fridge+PvtBath ,f,Excelsior,37.73027,-122.42644,46.00 ,1,Southern
84,69553,MISSION Outr BedRmU3+MinFridge,f,Excelsior,37.73128,-122.42478,45.00 ,1,Southern
85,69681,Panorama Pacific View - Pet Friendly,f,Richmond District,37.77707,-122.50923,185.00 ,4,Outside Lands
86,70139,Noe Valley Eco-Escape +Maid Service,f,Noe Valley,37.74527,-122.42424,108.00 ,2,Southern
87,70284,Monthly Shared Home for Students 1,f,Chinatown,37.79364,-122.40635,30.00 ,1,Downtown
88,70753,Dorm Bed In Friendly Hostel Community #1,f,Financial District,37.79447,-122.4045,45.00 ,1,Downtown
89,71645,Bernal Heights Northslope Studio,t,Bernal Heights,37.74578,-122.40841,109.00 ,1,Southern
90,71779,ｽﾀｼﾞｵｱﾊﾟｰﾄ,f,Richmond District,37.77625,-122.46466,80.00 ,1,Outside Lands
91,72365,Cozy loft in the center of SF. F1A,f,Western Addition/NOPA,37.77518,-122.43334,100.00 ,4,Western Addition
92,72444,Dorm Bed In Friendly Hostel Community #2,f,Financial District,37.79309,-122.40443,45.00 ,1,Downtown
93,72921,Wonderful private 1 bedroom apt. F6,f,Western Addition/NOPA,37.77588,-122.43143,95.00 ,2,Western Addition
94,73011,"Modern SoMa 1-bdrm, views, balcony",f,SoMa,37.77026,-122.41855,270.00 ,1,Southern
95,74451,Views of SF from a nice studio F5,f,Western Addition/NOPA,37.77388,-122.43298,120.00 ,2,Western Addition
96,74758, Mission Outr Rustic Pvt Bedroom ,f,Excelsior,37.73137,-122.42532,45.00 ,1,Southern
97,75422,Mission Outr CozyBedRm4+Minfridge,f,Excelsior,37.73128,-122.42473,40.00 ,1,Southern
98,75423,Mission Outr Big Precious Roomy Room,f,Excelsior,37.73048,-122.42494,45.00 ,1,Southern
99,77175,Private Studio w/ Kitchenette &Bath,t,Glen Park,37.73838,-122.43375,135.00 ,2,Southern
100,77932,"FAB BDRM w/ PrvtBATH, Patio,Fridge",f,Excelsior,37.73134,-122.42457,57.00 ,1,Southern
101,78651,Heart of the Mission: Hot spot,f,Mission District,37.75615,-122.41927,75.00 ,1,Southern
102,80394,Hideaway in the Haight,f,Haight-Ashbury,37.77065,-122.44252,140.00 ,2,Western Addition
103,81158,Sweet 1 br Garden Apartment -  Lewhit Cottage,t,Western Addition/NOPA,37.78493,-122.44618,83.00 ,2,Western Addition
104,81256,MISSION Outr BedRM#2 + 2Beds+Fridge,f,Excelsior,37.73152,-122.42547,45.00 ,1,Southern
105,81535,Heart of San Francisco D-town Loft,f,Civic Center,37.78025,-122.4131,250.00 ,1,Downtown
106,82919,"Quiet Room in Victorian House, Parking, City View",f,Bernal Heights,37.7343,-122.42092,97.00 ,1,Southern
107,83257,Charming Lower Pac Hts Private Room,t,Western Addition/NOPA,37.78528,-122.44358,90.00 ,1,Western Addition
108,83553,Sutro Garden View,f,Richmond District,37.77483,-122.50952,85.00 ,2,Outside Lands
109,84777,Upper Castro Studio,t,The Castro,37.75969,-122.44445,85.00 ,1,Western Addition
110,87640,"Garden Room/En-suite, Private Entrance",t,Noe Valley,37.7455,-122.42898,115.00 ,1,Southern
111,91957,Sunny SF Flat with 5*s,f,Cole Valley,37.76194,-122.44929,201.00 ,4,Western Addition
112,96383,Prime Location Bright Private Room,t,Pacific Heights,37.79176,-122.42476,59.00 ,1,North of Downtown
113,99094,Spacious Edwardian Flat SF Mission,f,Mission District,37.76809,-122.42439,185.00 ,3,Southern
114,100710,Stylish Living in Liberty Hill,f,Mission District,37.75629,-122.42518,450.00 ,4,Southern
115,102951,Monthly Shared Home for Students 2,f,Chinatown,37.79297,-122.40664,30.00 ,1,Downtown
116,105497,Private Room in San Francisco!,f,Outer Sunset,37.75754,-122.49852,85.00 ,1,Southern
117,106025,Gorgeous French Flat near Union Sq.,t,Tenderloin,37.78535,-122.41515,145.00 ,2,Downtown
118,109883,San Francisco Serenity/ lovely home,t,Balboa Terrace,37.73327,-122.46435,125.00 ,2,Western Addition
119,110825,Charming Cottage with Bay View,f,Bayview,37.71549,-122.38922,120.00 ,2,Southern
120,113211,Shelli''''s Student Home (1 Month Min),f,Chinatown,37.79294,-122.40659,30.00 ,1,Downtown
121,114401,Room w/ a View in the Castro!,t,The Castro,37.76102,-122.43005,125.00 ,1,Western Addition
122,115242,Tel Hill-1 Bdr (+sep Queen bed alcove) & Parking,t,Telegraph Hill,37.80591,-122.4083,125.00 ,2,Downtown
123,121065,Victorian 1BR/1BA in Castro/Duboce,f,Lower Haight,37.77083,-122.43109,200.00 ,2,Western Addition
124,126046,SF Victorian With Skyline Views ,f,Haight-Ashbury,37.76813,-122.44494,150.00 ,5,Western Addition
125,128230,Castro Sanctuary,t,The Castro,37.75887,-122.43565,328.00 ,2,Western Addition
126,130775,Emergency happy room-sink  UCSF/USF-San Francisco,f,Cole Valley,37.76609,-122.45126,65.00 ,1,Western Addition
127,130805,"Hip, Cozy, Creative, Victorian",t,Mission District,37.75586,-122.42092,97.00 ,2,Southern
128,132441,Calm Cool & Collected in Sunny Bernal Heights,t,Bernal Heights,37.73974,-122.42299,69.00 ,1,Southern
129,134015,"Marina location, rooftop GGB views+ private deck!",f,Marina,37.80356,-122.42589,275.00 ,4,North of Downtown
130,134193,Charming Family House near GG Park,f,Richmond District,37.7806,-122.47597,550.00 ,6,Outside Lands
131,137129,San Francisco Luxury Summer Rental,f,Richmond District,37.7879,-122.46474,850.00 ,1,Outside Lands
132,137546,Bernal Heights Gem near SF Mission,t,Noe Valley,37.74708,-122.42456,102.00 ,2,Southern
133,138592,Modern Architectural Gem - 4 Bdrm,t,Mission District,37.75558,-122.42474,"1,200.00 ",6,Southern
134,138619,North Beach View & Garden 1BD/1BA,f,Telegraph Hill,37.79835,-122.4042,150.00 ,2,Downtown
135,138772,Garden Studio,f,The Castro,37.75823,-122.43273,150.00 ,2,Western Addition
136,140568,Bernal Heights San Francisco Value,t,Bernal Heights,37.73874,-122.41624,90.00 ,1,Southern
137,142177,"Stylish, Spacious and Quiet Flat!",t,Richmond District,37.78471,-122.48125,399.00 ,4,Outside Lands
138,144043,Cozy Room in Eclectic SF Farmhouse!,f,Bernal Heights,37.74547,-122.40726,85.00 ,1,Southern
139,144978,Prime Location - Small Basic Room,t,Pacific Heights,37.79336,-122.42506,56.00 ,1,North of Downtown
140,147443,Best Views in all of San Francisco,f,Diamond Heights,37.74599,-122.44532,230.00 ,4,Southern
141,148559,"Central Victorian Apartment, 2.5 br",f,Duboce Triangle,37.76787,-122.43172,275.00 ,1,Western Addition
142,148769,Ground Floor Studio with Garage Parking,f,Twin Peaks,37.75195,-122.44928,115.00 ,2,Western Addition
143,150053,1600 sqft Luxury Apartment,f,South Beach,37.7876,-122.39222,600.00 ,2,Southern
144,150347,Cute Private 2Br Apt in the Mission,t,Mission District,37.76202,-122.41876,179.00 ,4,Southern
145,150848,SF Urban Haven & Secret Garden,t,Potrero Hill,37.762,-122.39391,75.00 ,1,Southern
146,162934,Designer remodeled studio,t,Richmond District,37.77761,-122.50378,149.00 ,1,Outside Lands
147,164207,"Quiet area by subway, private bath",t,West Portal,37.74159,-122.46578,69.00 ,1,Outside Lands
148,166199,Castro Cottage w/ Secret Garden,f,The Castro,37.76194,-122.43239,220.00 ,2,Western Addition
149,166771,DOWNEY STREET - Victorian Flat,f,Haight-Ashbury,37.76827,-122.44678,185.00 ,2,Western Addition
150,174679,Comfy room in large sunny flat in the Mission,t,Mission District,37.75452,-122.40716,80.00 ,2,Southern
151,175090,FINANCIAL DIST: Gino''''s Cozy Getaway,f,Financial District,37.79018,-122.40475,110.00 ,2,Downtown
152,175102,FIN. DIST: Mario''''s Studio Penthouse,f,Financial District,37.79076,-122.40403,135.00 ,2,Downtown
153,176274,Mission Outr PvtBDRm2D& minifridge,f,Excelsior,37.73143,-122.42325,45.00 ,1,Southern
154,177137,Grant Avenue Apartment,t,Chinatown,37.79675,-122.40781,135.00 ,1,Downtown
155,179876,Mission Mini Full Bed Spectacular | Safe & Central,f,Mission District,37.75606,-122.4089,92.00 ,2,Southern
156,181407,Centrally Located Secluded Garden Cottage,t,Glen Park,37.73723,-122.43139,155.00 ,2,Southern
157,183334,2 bedroom Bernal Heights Condo - FABULOUS views!,t,Bernal Heights,37.74531,-122.41122,225.00 ,4,Southern
158,183859,"Family-Friendly Flat In San Francisco, CA. USA",t,Glen Park,37.73626,-122.43677,220.00 ,3,Southern
159,187730,Bohemian Rhapsody in the Mission,f,Mission District,37.75757,-122.41939,75.00 ,1,Southern
160,189068,Bernal Heights Live Like a Local,t,Bernal Heights,37.73856,-122.41687,90.00 ,1,Southern
161,189894,SF  PRIME MARINA LOCATION RENTAL,t,Marina,37.80318,-122.42977,150.00 ,1,North of Downtown
162,191632,Private Entrance Garden Studio,t,Western Addition/NOPA,37.77311,-122.44979,138.00 ,2,Western Addition
163,199480,One room overlooking Precita Park,t,Bernal Heights,37.74557,-122.41187,90.00 ,1,Southern
164,201313,Fully Furnished 1 bedroom apartment,f,Telegraph Hill,37.8034,-122.40485,182.00 ,1,Downtown
165,201579,Renovated Historic Home,f,Alamo Square,37.77756,-122.43326,136.00 ,4,Western Addition
166,206566,Monthly Shared Home for Students 3,f,Chinatown,37.79507,-122.40498,30.00 ,1,Downtown
167,206634,Monthly Shared Home for Students 4,f,Chinatown,37.79466,-122.40523,30.00 ,1,Downtown
168,206637,Monthly Shared Home for Students 5,f,Chinatown,37.79291,-122.40637,30.00 ,1,Downtown
169,207980,"3 Bdrm City View Home w/Parking, deck,",t,Noe Valley,37.74446,-122.43776,295.00 ,6,Southern
170,208727,"Full Floor Flat, Priv.Bath Mid-Richmond,",t,Richmond District,37.78265,-122.48971,85.00 ,1,Outside Lands
171,208831,Virtually Your Own Apt in Nth Beach,t,North Beach,37.80242,-122.4144,165.00 ,2,Downtown
172,209514,Haight Ashbury Experience Room 2,f,Haight-Ashbury,37.77118,-122.44963,92.00 ,1,Western Addition
173,212265,"Sunny Condo in the Mission, San Francisco",f,Mission District,37.75551,-122.40882,178.00 ,1,Southern
174,212783,Haight Ashbury Experience Room 1,f,Haight-Ashbury,37.77108,-122.44942,98.00 ,2,Western Addition
175,213532,Haight Ashbury Experience Room 4,f,Haight-Ashbury,37.77085,-122.44811,78.00 ,1,Western Addition
176,213854,Victorian Flat,f,The Castro,37.76146,-122.43817,325.00 ,4,Western Addition
177,216042,Bernal Heights Views Garden Hottub,f,Bernal Heights,37.74382,-122.41773,147.00 ,1,Southern
178,216064,AUMVersity Subodhi Room,t,Mission Terrace,37.72652,-122.43468,75.00 ,1,Outside Lands
179,217106,Great Ashbury Studio in SF  #3,f,Haight-Ashbury,37.76468,-122.44523,110.00 ,2,Western Addition
180,218567,Balcony on Fillmore Street +Parking,f,Western Addition/NOPA,37.78594,-122.43219,200.00 ,2,Western Addition
181,220418,Haight Ashbury Experience Room 3,f,Haight-Ashbury,37.77042,-122.45019,78.00 ,1,Western Addition
182,221342,Penthouse Master Suite Panoramic View with Decks,f,Russian Hill,37.80281,-122.4154,139.00 ,1,North of Downtown
183,224579,Beautiful luxury house w/ Deck,t,Mission District,37.75632,-122.40478,145.00 ,2,Southern
184,225205,Private Mission Room Near Valencia,f,Mission District,37.76097,-122.42313,115.00 ,1,Southern
185,225933,Art lovers to the Duboce Triangle!,t,Duboce Triangle,37.7684,-122.43086,99.00 ,2,Western Addition
186,229240,Dorm Bed In Friendly Hostel Community #3,f,Financial District,37.79341,-122.4034,45.00 ,1,Downtown
187,229319,Bernal pied-à-terre,t,Bernal Heights,37.73819,-122.41566,135.00 ,2,Southern
188,231129,Nob Hill Mini Mansion 4b/4b,f,Nob Hill,37.79114,-122.41029,989.00 ,8,Downtown
189,231752,Mid-Century Garden Flat in Charming Upper Castro Victorian,t,The Castro,37.75565,-122.44022,250.00 ,2,Western Addition
190,232060,Lovely Private Suite Near UCSF- Monthly Only,f,Inner Sunset,37.75855,-122.46444,99.00 ,2,Western Addition
191,238190,Contemporary Penthouse with Two Beds and City View,f,Russian Hill,37.80301,-122.41581,99.00 ,1,North of Downtown
192,238204,Spacious SF Getaway Near The Ocean,t,Outer Sunset,37.74174,-122.50435,135.00 ,2,Southern
193,241235,Dorm Bed In Friendly Hostel Community #4,f,Financial District,37.79271,-122.40383,45.00 ,1,Downtown
194,242008,One Bedroom SOMA apartment,t,SoMa,37.77499,-122.40635,160.00 ,2,Southern
195,242477,Spacious and Airy Flat Steps from Castro with a Great Yard,t,The Castro,37.75967,-122.44257,225.00 ,5,Western Addition
196,244361,North Beach Chinatown Apartment,t,Chinatown,37.79532,-122.40863,135.00 ,1,Downtown
197,245339,1 Bedroom near Ballet Symphony,t,Tenderloin,37.78304,-122.41942,138.00 ,1,Downtown
198,252867,Potrero Hill Condo with View of Bay,f,Potrero Hill,37.75889,-122.39539,280.00 ,4,Southern
199,256148,Spacious Quiet Rm w/Private Ensuite Bath in Castro,t,The Castro,37.76188,-122.44215,139.00 ,1,Western Addition
200,256176,Private entrance bd/bath by GG Park,t,Richmond District,37.77579,-122.45504,100.00 ,1,Outside Lands
201,258786,Room with Bay Views,f,Bernal Heights,37.7435,-122.40805,75.00 ,1,Southern
202,258873,Stay in the heart of North Beach!,f,Telegraph Hill,37.80134,-122.40714,89.00 ,1,Downtown
203,259621,Dorm Bed In Friendly Hostel Community #6,f,Financial District,37.7947,-122.40374,45.00 ,1,Downtown
204,259622,Dorm Bed In Friendly Hostel Community #5,f,Financial District,37.79441,-122.40473,45.00 ,1,Downtown
205,259919,Golden Gate Park 1BR,f,Cole Valley,37.7647,-122.45368,114.00 ,1,Western Addition
206,261358,Studio with Rooftop Deck,t,Tenderloin,37.78322,-122.42025,138.00 ,1,Downtown
207,269371,Delux Digs by Buena Vista Park,t,The Castro,37.76294,-122.43974,115.00 ,1,Western Addition
208,269463,Elegant Victorian Flat in Haight,f,Cole Valley,37.76711,-122.45151,250.00 ,2,Western Addition
209,271602,Luxury Condo Downtown/ SoMa,t,SoMa,37.77641,-122.40454,133.00 ,2,Southern
210,271647,SURF Ocean Beach + Golden Gate Park,f,Outer Sunset,37.75553,-122.50707,35.00 ,1,Southern
211,273530,Sunny Potrero Townhouse Nest,t,Potrero Hill,37.75612,-122.39967,325.00 ,4,Southern
212,274334,Newly remodeled clean/private bath,f,Outer Sunset,37.75346,-122.50358,89.00 ,1,Southern
213,276072,Bright rm/Mission (w/pinball),t,Mission District,37.76833,-122.42592,95.00 ,1,Southern
214,277339,Comfortable and tranquil SF escape,t,Mission Terrace,37.72681,-122.43419,110.00 ,1,Outside Lands
215,279184,"Perfect family home, 3 BR in the Mission, backyard",t,Mission District,37.7529,-122.41553,575.00 ,4,Southern
216,280549,Bungalow Rooms with Great Views,t,Sunnyside,37.73773,-122.44956,250.00 ,1,Western Addition
217,284117,"Cozy, Charming Cottage nestled in a Quiet Garden",t,Noe Valley,37.74334,-122.42932,105.00 ,2,Southern
218,284766,Converted 1911 Stable  - Cow Hollow/Marina,t,Cow Hollow,37.79921,-122.43191,300.00 ,1,North of Downtown
219,285499,Castro States Street View Penthouse,f,The Castro,37.76288,-122.43815,210.00 ,1,Western Addition
220,285755,Modern in the ❤ of the Mission District!,t,Mission District,37.75395,-122.41917,145.00 ,1,Southern
221,286311,Spacious Corona Heights flat with views,t,The Castro,37.76275,-122.44252,475.00 ,6,Western Addition
222,287907,Perfect Base ~15 min to Downtown on public transit,t,Glen Park,37.73225,-122.43614,300.00 ,4,Southern
223,288213,Stylish Potrero Garden Flat for Two,t,Dogpatch,37.75971,-122.38833,190.00 ,2,Southern
224,292723,Mission Outr PvtBDRmD3 + MiniFridge,f,Excelsior,37.73096,-122.42378,45.00 ,1,Southern
225,295240,Garden Apartment Oasis with Lush Greenery and a Hot Tub,t,The Castro,37.76267,-122.43919,299.00 ,1,Western Addition
226,295565,SF BedRM 4,f,Excelsior,37.7303,-122.42464,30.00 ,1,Southern
227,297897,Tidy Flat 1 block beach/ MUNI +Free Exploritorium,f,Outer Sunset,37.75737,-122.50619,296.00 ,1,Southern
228,298368,Perfect Modern 1BD  Mission SF Apt,f,Mission District,37.76259,-122.41748,160.00 ,1,Southern
229,307837,"Lovely, garden studio apartment",f,Noe Valley,37.75131,-122.437,159.00 ,1,Southern
230,308885,North Beach Best Location and View,f,Telegraph Hill,37.79954,-122.40679,150.00 ,1,Downtown
231,314248,Pacific Heights 3 bedroom home,t,Pacific Heights,37.79026,-122.4364,325.00 ,1,North of Downtown
232,314368,2BR North Beach - Perfect for Business or Leisure,t,Telegraph Hill,37.80345,-122.40798,600.00 ,2,Downtown
233,317078,Alamo Square 1 bedroom Apt. F1B,f,Alamo Square,37.77612,-122.43292,100.00 ,2,Western Addition
234,317121,Small but practical studio in SF,f,Haight-Ashbury,37.76641,-122.44667,90.00 ,2,Western Addition
235,317951,Woodward Garden Suite,f,Mission District,37.7667,-122.41992,150.00 ,2,Southern
236,323635,Sleep in  AUMVersity Altar Room.,t,Excelsior,37.72606,-122.43232,48.00 ,1,Southern
237,325478,Spacious & artsy 2br Dolores Park flat,t,Mission District,37.76065,-122.42414,365.00 ,4,Southern
238,326650,Lovely beautiful Apt Pac Fillmore,f,Western Addition/NOPA,37.78633,-122.43217,139.00 ,2,Western Addition
239,329020,"The Clock Tower, circa 1907.",f,South Beach,37.78278,-122.39337,250.00 ,2,Southern
240,330535,Victorian Flat amongst the Trees.,f,Haight-Ashbury,37.76892,-122.44615,189.00 ,3,Western Addition
241,330736,Luxury Condo w/ Views & Whole Foods,f,Potrero Hill,37.76592,-122.40628,298.00 ,2,Southern
242,334339,Castro Cottage: Room & Private Bath,t,The Castro,37.76295,-122.44259,99.00 ,1,Western Addition
243,334886,Marina Designer Showplace SPECIAL COSY RM,t,Marina,37.80432,-122.44601,150.00 ,1,North of Downtown
244,338849,Best area Bright LARGE Beautiful,f,Western Addition/NOPA,37.78525,-122.43051,99.00 ,1,Western Addition
245,342420,Large Victorian House in Castro,f,The Castro,37.76052,-122.42939,595.00 ,6,Western Addition
246,348580,Lovely view condo near BART/Mission,f,Bernal Heights,37.74271,-122.41955,160.00 ,2,Southern
247,348714,Elegant Queen Ann Victorian,t,Western Addition/NOPA,37.77307,-122.44293,190.00 ,2,Western Addition
